id,name,countReview,discountPercentage,price,rating,category
13161645782,KAOS POLO SHIRT FERRARI RACING TEAM F1 2024 KAOS POLO PRIA PREMIUM GRADE ORIGINAL POLOSHIRT TERBARU,70,18,139000,5,Kaos Polo Pria
4308431617,Giordano Polo Shirt Man Lion 3D Tapered Fit Signature White New,20,0,469000,5,Kaos Polo Pria
13419054194,Kaos Polo Shirt F Perry Pria Lengan Pendek Kaos Kerah Regular Fit,102,0,109000,5,Kaos Polo Pria
13772391457,Otsky Polo Shirt Pria Knit Nigar Premium,8,67,99900,5,Kaos Polo Pria
398699048,Polo Team Liquid Navy Blue - Gaming Shirt Kaos Baju Dota,6,67,49000,5,Kaos Polo Pria
10509185600,AKITA POLO SHIRT - Kaos Polo Pria in Sky Blue (Biru Muda),68,1,117810,5,Kaos Polo Pria
6258850644,Kaos polo pria premium QUALITY~baju kerah pria~t-shirt priaa,400,0,95999,5,Kaos Polo Pria
1339346202,Kaos Polo Kerah Country Fiesta 100% Original CF,143,0,145000,5,Kaos Polo Pria
1129428385,KAOS SERAGAM POLOS POLO KERAH PRIA,3296,0,32200,5,Kaos Polo Pria
7426135844,Kaos polo Battle x,3,0,210000,5,Kaos Polo Pria
7116702146,Bloods Polo Shirt Wicked 01 Black,43,0,200000,5,Kaos Polo Pria
12355923795,ARNOLD PALMER POLOSHIRT LENGAN PENDEK HITAM PRIA - P-XXXA07-B9,18,54,259900,5,Kaos Polo Pria
13089976978,Kaos Polo Fred Perry Made In England,17,0,219000,5,Kaos Polo Pria
2324153987,Kaos Polo Shirt Pique CVC KPM Apparel Big Size Part 3,751,60,74900,5,Kaos Polo Pria
9617187586,FRED PERRY Black Polo T-Shirt - Pink Logo,39,21,1099000,5,Kaos Polo Pria
6170550303,Kaos Kerah Pria Polo shirt Golf J.Lindeberg,42,0,119900,5,Kaos Polo Pria
12628304097,Kaos Polo Pria Model Korea Berkerah Premium Katun Combed 24S Original,239,7,125000,5,Kaos Polo Pria
11814825726,Kaos Polo Shirt BIRU MUDA / SKY BLUE Polos Kerah Kombinasi List UNISEX,34,0,34900,5,Kaos Polo Pria
13627785721,M&S - Polo - Cotton Rich Short Sleeve Knitted Polo Shirt - Light Blue,5,40,359000,5,Kaos Polo Pria
12328058824,Kattoen - Kaos Polos Polo Shirt Bordir Kattoen,26,0,230000,5,Kaos Polo Pria
15691309350,Stussy Polo Long Sleeve Jersey Black White,0,0,2499000,0,Kaos Polo Pria
10006612990,Dobujack Polo Shirt Mavin White,74,55,111465,5,Kaos Polo Pria
10949919953,Kaos Polo Pria SINONIMS Classic Polo Shirt Dusty rose,89,41,118000,5,Kaos Polo Pria
13619819086,POLO SHIRT MAYBANK - Poloshirt Maybank - Kaos Maybank Kaos Bank POLO,24,0,55000,5,Kaos Polo Pria
9863931023,polo shirt jumbo xxl 3xl 4xl atasan pria terlaris baju berkerah polo shirt seragaman,60,17,62250,5,Kaos Polo Pria
3807691700,kaos kerah polo shirt lengan panjang uk M L XL XXL XXXL,121,0,39000,5,Kaos Polo Pria
11987616214,Kaos pria polo shirt saku kerah polos | kaos kerah pria dewasa,27,0,34800,4,Kaos Polo Pria
11958147191,Aerostreet Polo Shirt Hans Army Green Kaos Kerah Poloshirt QFAAA,241,53,84506,5,Kaos Polo Pria
15590776030,Crocodile FAST - Baju Pria Men Polo Shirt - Relax Fit,7,0,529000,5,Kaos Polo Pria
11595802209,Red Bull Racing F1 2023 Team Polo. Kaos Polo Pria,19,17,1250000,5,Kaos Polo Pria
12265535912,kaos krah polos / kerah polo shirt pria lengan pendek uk M L XL XXL,509,0,33000,5,Kaos Polo Pria
13148955006,Commongoods Short Sleeve Polo Revere Series,26,36,114000,5,Kaos Polo Pria
13256767427,Kaos Kerah Pria dry fit seamless tanpa jahitan jumbo ukuran besar,62,0,175000,5,Kaos Polo Pria
6905829057,Polo Shirt Pria Kerah Shanghai Kaos Polo Polos Hitam Black Casual,97,43,84999,5,Kaos Polo Pria
12819362451,Comme des Garcons RED EMBLEM BLACK POLO 100% Original,4,17,2500000,5,Kaos Polo Pria
13100324085,Bloods Series Polo Boredom 04 White,7,50,105000,5,Kaos Polo Pria
13699770827,zafos.id - kaos polo shirt pria polos hitam kerah zipper bahan knit kasual distro terbaru,30,15,84900,5,Kaos Polo Pria
12061241366,Kaos Kerah Pria Polo shirt Airborne Militer American,4,0,119900,5,Kaos Polo Pria
12178079577,KAOS POLO PREPP STUDIO OVERTURE POLO SHIRT WHITE,6,0,249000,5,Kaos Polo Pria
7495881828,HRC22 RWB POLO SHIRT AHPS0202012,7,0,357000,5,Kaos Polo Pria
14294130945,Jack Nicklaus Eminent Polo Shirt Pria Slim Fit White,1,70,199000,5,Kaos Polo Pria
7441932571,Kaos kerah pria | kerah polos saku dewasa lengan pendek pakaian pria..,84,0,37800,5,Kaos Polo Pria
14305028403,BARU ....!!! Kaos Polo Distro Lengan pendek Polo Shirt Distro Cardinal,26,0,107000,5,Kaos Polo Pria
1039264311,Tactical Polo Molay Advance Striker Polo Shirt MKII Kaos Polo,16,0,310000,5,Kaos Polo Pria
2643630045,Bloods Polo Shirt Damascuss 01 Black,68,0,189000,5,Kaos Polo Pria
9710346481,Noforty Oversize Polo Shirt / Trunk Dark Grey,39,27,124000,5,Kaos Polo Pria
14489140144,SAGI Men Joey Long Vintage Polo Shirt | Polo Shirt Lengan Panjang Pria | Kaos Pria Berkerah PC-12,4,50,149900,5,Kaos Polo Pria
9948528165,MORWICK Polo Shirt Rugby Pria Clap - Black,45,52,100000,5,Kaos Polo Pria
11992302328,OOTDSUPPLY Oversize Polo Shirt Enthusiast Clubs l Kaos Polo OVZ-PS010,32,0,225000,5,Kaos Polo Pria
12408388303,Kale Wale - Kaos premium bahan dasar Cotton Viscose Waffle,63,11,157000,5,Kaos Polo Pria
7283834281,kaos wangki pria ukuran m l xl xxl indonesia garuda,115,0,34000,5,Kaos Polo Pria
10155111261,Cottongo Polo Shirt Steel Blue,160,74,129000,5,Kaos Polo Pria
2735764627,kaos kerah polo shirt kerah polos Saku lengan panjang uk L XL XXL,180,0,39000,5,Kaos Polo Pria
11698576629,Okinawa Polo Shirt Diamond White – Polo Knit Diamond Premium Putih,18,14,129000,5,Kaos Polo Pria
10737224314,kaos kerah polos pria / polo tshirt/kaos krah premium,284,5,84900,5,Kaos Polo Pria
2936454275,Kaos Polo Shirt Kerah Shanghai Pria Dewasa Lengan Pendek,187,0,33000,5,Kaos Polo Pria
14449185783,DGM Kaos Polo Shirt Pria Premium Knit Putih 2452,1,66,75000,5,Kaos Polo Pria
11775912367,Exhale Apparel Tshirt/Kaos Polo Regular Monogram Green Pria,26,31,139000,5,Kaos Polo Pria
12848513996,Houseofcuff Polo Shirt Half Zip Kaos Kerah Polo Sleting Hitam,27,34,165000,5,Kaos Polo Pria
10601539251,Kaos Polo Guard,5,0,45000,5,Kaos Polo Pria
5847505912,Kaos polo shirt pria polos Hitam | kaos kerah pria seragam polos,103,0,29800,5,Kaos Polo Pria
6587676859,Polo Shirt Keren | Polo Shirt Pria Hitam | Polo Shirt Hitam | Polo Shi,39,0,198000,5,Kaos Polo Pria
3392899988,EIGER LEGERITY POLO SHIRT,131,20,175200,5,Kaos Polo Pria
12963711553,Jack Nicklaus Bariton Polo Shirt Pria Regular Fit Black,22,50,329500,5,Kaos Polo Pria
7091103239,Vespa Polo Grey,18,0,458400,5,Kaos Polo Pria
14977523858,BlueButton Polo Shirt Olive Green,33,61,145000,5,Kaos Polo Pria
6791798430,POLO - 0013.75 Mens Shirt Custom Fit 100% - Green,112,75,99000,5,Kaos Polo Pria
12290821513,OOTDSUPPLY Oversize T-shirt Essentials | Kaos Polo OVZ-PS020,20,0,225000,5,Kaos Polo Pria
6791798761,POLO - 0013.81 Mens Shirt Custom Fit 100% - Purple,98,75,99000,5,Kaos Polo Pria
2332765558,SAPPORO POLO LONG SLEEVE - Kaos Polo Pria Lengan Panjang in Steel Blue,95,0,139000,5,Kaos Polo Pria
3372879610,LGS - Kaos Polo Pria - Regular Fit - Coklat - CTS.224.M2263.03.C,13,50,184950,5,Kaos Polo Pria
15068728805,Hammer Man Polo Stripe I1OPS20,4,55,169900,5,Kaos Polo Pria
12606777322,Kaos Polo Knit Shirt / Kaos Kerah Pria / Lengan Pendek / Mango Knit,59,0,135000,4,Kaos Polo Pria
7316001734,Kaos polo Pria Adidas Aeroready designed.GM2154,2,0,400000,5,Kaos Polo Pria
14431593882,Baju Polo Pria Nike Club Matchup Polo - CJ4457-063,2,30,384300,5,Kaos Polo Pria
1941328499,STAND OUT Flawless Fit Polo Shirt Hitam Black // MENLIVING MEN LIVING,138,0,116000,5,Kaos Polo Pria
12356003842,ARNOLD PALMER POLOSHIRT LENGAN PENDEK HIJAU TUA PRIA - P-XXXA07-G9,10,55,249900,5,Kaos Polo Pria
7698150516,Nara Oversize Polo in Black - Kaos Polo Oversize Pria Hitam - ByBlank,90,0,180000,5,Kaos Polo Pria
10599196315,Obermain Polo Pria ESSENCE Olive OPA22010OL,2,70,149000,5,Kaos Polo Pria
13594074141,POSHBOY Kaos Kerah Pria Zipper Lengan Pendek Motif,52,72,99900,5,Kaos Polo Pria
9003874205,Jobb Sanders Polo Shirt Pria Lengan Pendek Slim Fit Light Grey,69,77,99000,5,Kaos Polo Pria
11677319439,Hush Puppies Kaos Polo Pria Tango 4 Navy,296,50,229000,5,Kaos Polo Pria
3561951415,Bloods Polo Shirt Columz 02 Black,78,50,94500,5,Kaos Polo Pria
14073774673,Cole Knit NYC Kaos Kerah Pria 120751018,6,40,119940,5,Kaos Polo Pria
13348671656,Polo shirt Kaos Kerah Team Ducati Moto Gp Series,14,0,125000,5,Kaos Polo Pria
12298794527,PSR10E - Aspro - Polo Shirt - Japan,46,68,79000,5,Kaos Polo Pria
11307076814,Kadaka MT-0184 Knit Polo Shirt Men | Kaos Pria Kerah,101,0,139000,5,Kaos Polo Pria
13150471139,Kaos Polo Jumbo Toffee Big Pria Size S M L XL XXL 3XL 4XL 5XL 6XL Kerah,17,0,64000,5,Kaos Polo Pria
11958140574,Aerostreet Polo Shirt Hans Dark Grey Kaos Kerah Poloshirt QFAAA,313,53,84506,5,Kaos Polo Pria
11441459453,Sapporo Polo Long Sleeve Coffee - Kaos Polo Pria Lengan Panjang Coffee,42,1,137610,5,Kaos Polo Pria
6982345959,Kaos Polo Pria SINONIMS Buttonless Polo Shirt Hitam,130,41,118000,5,Kaos Polo Pria
2109373993,kaos polo polos pria XXXXL Big size Jumbo Bisa Bayar di tempat COD,155,0,58900,5,Kaos Polo Pria
15313306332,VSH Polo Shirt LS Green - Kaos Lengan Panjang Polo Hijau Vish by Nevertoolavish,1,36,165000,5,Kaos Polo Pria
6816580080,Wellen Project Kaos Polo Abu Misty Muda Pollo Shirt Grey Pria Casual,81,0,69000,5,Kaos Polo Pria
6816623420,Wellen Project Kaos Polo Biru Dongker Pollo Shirt Navy Pria Casual,68,0,69000,5,Kaos Polo Pria
14936810161,Kaos Kerah Pria Polo Shirt Reguler Atasan fit 1 - Fatto  A Mano,24,30,84500,5,Kaos Polo Pria
1145070942,Kaos polo polos pria / Kaos kerah seragam,1411,0,31800,5,Kaos Polo Pria
13333971384,Hammer Man Polo Fashion B1PI008,41,0,379900,5,Kaos Polo Pria
4281238071,Kaos atasan pria dewasa berkerah Polo Shirt cowok Lengan Pendek NB004,32,0,38000,5,Kaos Polo Pria
1554620828,Heyman Polo Shirt Comfy - Black,62,0,134990,5,Kaos Polo Pria
13821065243,SAGI Men - Rio Upper Zip Jacket | Outer Jacket Pria Knit | Kaos Pria Berkerah Half Zip PC-10,3,50,149900,5,Kaos Polo Pria
13100786677,FRED PERRY Dark Green 3D Graphic Black Polo Shirt,17,64,727000,5,Kaos Polo Pria
7236583583,MSMO MEN Emer Oversized Waffle Tee / Oversized Tee / Kaos Oversize,0,72,76900,0,Kaos Polo Pria
2089351919,Kaos Polo Poloshirt Turn Back Crime Polisi - polo shirt POLICE,66,0,60000,5,Kaos Polo Pria
12626917739,Rugby Lengan pendek oversize Vintage Short Polo Shirt  aplikasi Black,19,0,115000,5,Kaos Polo Pria
9584182489,Tshirt Baju Polo Kerah Official Team F1 Mclaren 2023 Series Premium,23,0,114999,5,Kaos Polo Pria
12857878330,Kappa Kaos Polo Pria Lengan Pendek Polo Shirt Men POLO-KP-01 Black,3,47,79900,5,Kaos Polo Pria
12638270311,Jack Nicklaus Mauro Polo Shirt Pria Slim Fit Denim Blue,13,60,263600,5,Kaos Polo Pria
12036298754,Juaraga Satria Muda Polo Shirt Satria Muda Basket 2023 - Biru,9,0,349900,5,Kaos Polo Pria
13009819522,Kaos T Shirt Polo timnas Indonesia Logo Garuda terbaru full sablon,24,0,75000,5,Kaos Polo Pria
12421983792,NAUTICA Men Polo - NAUK517016NR,3,44,223440,5,Kaos Polo Pria
12523488093,Li-Ning Polo Shirt APLN182-1 Grey,1,55,180000,5,Kaos Polo Pria
7969626206,Concave - Polo Shirt - Cave Lifestyle - White / Red,10,55,179550,5,Kaos Polo Pria
7771956823,Kaos Wangky Cartenz Tactical Carnaby,0,0,345000,0,Kaos Polo Pria
14801006717,UNIQO_STORE ~ Kaos Polo Shirt Kaos Kerah LCT Kaos Kerah Premium Quality - Wardah M L XL,9,50,85450,5,Kaos Polo Pria
15369525555,Koos Polo Mens Ice Silk SeamLess Original  Slim Fit,44,0,225000,5,Kaos Polo Pria
13027415884,Kadaka MT-0199 Basic Polo Shirt Men | Atasan Kaos Kerah Pria Knit,26,0,139000,5,Kaos Polo Pria
7119635155,Cottongo Polo Shirt Sage Green,159,0,129000,5,Kaos Polo Pria
15011576812,SMOOTH BASIC Lisse Series Oversized Boxy Polo Pocket In Black,2,40,149000,5,Kaos Polo Pria
12042753750,Kaos Kerah Polo Shirt Pria Polos Lengan Pendek Original Broguy - Beige,80,0,99000,5,Kaos Polo Pria
11885174203,TYPE B01 - POLO MY REPUBLIC INTERNET TERBAIK TANPA BATAS - FORONESTYLE,5,0,60000,4,Kaos Polo Pria
14654456402,COZYCLUB Jason Polo Knit Shirt | Kaos Polo Pria Kerah - Kaos Lengan Pendek | 71,19,52,109000,5,Kaos Polo Pria
12335347106,Toyota Gazoo racing polo shirt type 1 -black kaos kerah hitam,1,0,450000,5,Kaos Polo Pria
8922674572,Watchout Pakaian Pria Southampton Shirt - WK3001800,5,55,173506,5,Kaos Polo Pria
11808538926,polo shirt MOBIL MERCY MERCEDEZ BENZ INDONESIA COMMUNITY otomotif club,6,0,120000,5,Kaos Polo Pria
8615870647,Original Official Formula 1 F1 Team Polo 2023,31,0,1450000,5,Kaos Polo Pria
14822913982,PUMA Kaos Grafis Polo Pria Scuderia Ferrari Race Black,0,0,899000,0,Kaos Polo Pria
4191223535,Polo Shirt Original BMW AG,2,60,768000,5,Kaos Polo Pria
2026375360,Kaos wangki krah lengan Pendek Dewasa Simpel Elegan - Jfashion PoloMen,57,50,17500,5,Kaos Polo Pria
10278959615,CDG Play Black Heart Polo Shirt,68,0,429000,5,Kaos Polo Pria
12760269894,Otsky Kaos Polo Oversize Collar Dream Team White X PK002,4,75,101900,5,Kaos Polo Pria
6793409742,Kaos Kerah Pria Polo shirt Lengan Panjang Golf J.Lindeberg,66,0,139900,5,Kaos Polo Pria
12420273828,Kaos Kerah Premium | Poloshirt | Oepro | Black,30,0,88000,5,Kaos Polo Pria
12704614321,TENDENCIES Lest Polo Shirt White,18,51,135000,5,Kaos Polo Pria
14823467088,PUMA Polo Motorsport Pria Berlogo F1 ESS Black,1,0,699000,5,Kaos Polo Pria
7116723925,Bloods Polo Shirt Wicked 02 Navy,41,0,200000,5,Kaos Polo Pria
14880112109,PERSIB POLO OFFICIAL 2024 BLUE,8,0,249000,5,Kaos Polo Pria
3921136171,Hosvon Kaos Kerah Wangki Cotton 100% Size S-XXL ( PRIA & WANITA ),161,0,46500,5,Kaos Polo Pria
11964672769,KLAMBEN Kaos Kerah Batik Dewasa Premium Peksi Kawung Coklat Susu,30,0,87500,5,Kaos Polo Pria
1210469048,Kaos Kerah Polo shirt Custom Logo Design sendiri Sablon/Bordir SATUAN,963,4,75636,5,Kaos Polo Pria
12630590442,#986 Kaos Kerah Pria Dewasa Saku/Kantong Motif,6,0,75000,5,Kaos Polo Pria
12902840563,TYPE 06 POLOSHIRT MERDEKA BELAJAR - KAOS KERAH MERDEKA BELAJAR ,4,0,60000,5,Kaos Polo Pria
11372657325,Oversize Polo Shirt Pendek Pria /  Polo Shirt Premium / Kaos polo Pria,56,0,74000,5,Kaos Polo Pria
6025068649,Giordano National Day Polo Pria Signature White 504,12,66,164000,5,Kaos Polo Pria
12520673531,Polo Shirt MAROON / PoloShirt / Kaos Kerah Polos Kombinasi Unisex,246,0,26500,5,Kaos Polo Pria
8375254862,Noir Polo Shirt,311,24,110000,5,Kaos Polo Pria
9189287227,Human Greatness Tipping Polo Shirt Navy,193,29,175000,5,Kaos Polo Pria
2812985257,"Polo shirt cotton pique polos uk. M,L,XL warna Hijau Tosca",32,0,48000,5,Kaos Polo Pria
14269617624,Sapporo Polo Long Sleeve in Navy - Kaos Polo Pria Lengan Panjang Biru Dongker – ByBlank,9,0,139000,5,Kaos Polo Pria
9612051624,MOC Kaos Polo Lengan Pendek CLAUDE- GREY,11,52,111000,5,Kaos Polo Pria
13554656625,Kaos Polairud   - Kaos Jersey Polairud  - Kaos DryFit Polairud,5,0,52500,5,Kaos Polo Pria
12681620029,Polo shirt Ducati kaos kerah motogp Kaos Seragam Motogp Kaos Ducati,19,0,110000,5,Kaos Polo Pria
13655638883,BAJU GOLF ADIDAS PERFORMANCE POLO SHIRT IU4447 / 20241,1,20,648000,5,Kaos Polo Pria
14810652314,PRL Classic Bear Logo Polo Shirt,1,0,349000,5,Kaos Polo Pria
12768588477,ARNOLD PALMER POLO SHIRT BASIC HIJAU EMERALD PRIA - P-XXXA08-G9,22,54,259900,5,Kaos Polo Pria
13530835494,Thenational Oversize Rugby Polo Shirt White,6,0,98000,5,Kaos Polo Pria
13559083632,SANVANINA Polo Shirt Pria Mano Waffle Knit | Kaos Pria Berkerah | Mano Upper Zip Polo Shirt PC-09,19,57,119800,5,Kaos Polo Pria
15341750515,Matsuda Kaos Henley Pique Hino,820,63,85000,5,Kaos Polo Pria
11468837480,POLO KAOS PRIA COLOMBIA ABU MURAH SIZE M SD 4XL,5,0,100000,4,Kaos Polo Pria
13111141004,Men Power Polo - Line White - PALM Playwear,8,10,314100,5,Kaos Polo Pria
13577074193,Team Polo VCARB VISA CASHAPP CASH APP RB original 2024 mens pria HUGO formula 1 F1 new baru toro rosso alpha tauri scuderia,5,0,1574000,5,Kaos Polo Pria
2359927415,BAJU POLOSHIRT - KAOS POLO BNN CRIME HUNTER - POLO SHIRT BNN SABLON,28,0,55000,5,Kaos Polo Pria
1996716497,Poloshirt Lion Parcel - Baju Polo Lion Parcel - Kaos Lion Parcel,10,0,55000,5,Kaos Polo Pria
12179655075,POLO SHIRT REDBULL CASTORE MOTOGP TEAM 2023 GRADE ORIGINAL KAOS PRIA,116,38,109000,5,Kaos Polo Pria
14328278293,Kerah Daun Saku Zebra Lengan Garis Combed Pendek Tebal,9,51,69000,5,Kaos Polo Pria
14654167483,Mntbell warm long sleeve polo shirt,12,0,154000,5,Kaos Polo Pria
3067916050,Pique/Lakos CVC 24 Per KG Warna Sedang |Bahan Kain Polo/Kaos Krah,3,0,129200,5,Kaos Polo Pria
9799851712,DSS Polo Shirt Dryfit Short Sleeve Black,36,70,59900,5,Kaos Polo Pria
8635644004,Kaos Polo Shirt Gildan 73800 Sport Shirt,65,14,60000,5,Kaos Polo Pria
10599361883,Obermain Polo Pria BOILER SS POLO Navy OPA22005NV,2,70,149000,5,Kaos Polo Pria
14437225672,LACOSTE Men's Embroidered Slogan Polo Shirt [100% Authentic],6,67,999000,5,Kaos Polo Pria
5514473624,MILLS Timnas Indonesia Poloshirt 17027INA,24,25,374250,5,Kaos Polo Pria
11767266555,T-Shirt-6 Kaos Polo Pria Kerah Lengan Panjang Bordir Adem M-2XL /35341,20,0,49400,5,Kaos Polo Pria
2742865973,Hammer Man Polo Basic Online Z1PO001-W1,188,48,129900,5,Kaos Polo Pria
12655368458,WOOD Textured Short Sleeve Polo Shirt 2-PSILXC124B028 Lt. Taupe,8,50,199950,5,Kaos Polo Pria
13732292968,Baju Polo Shirt Golf Polyester Dry Fit CoolMax Birdie SE24,13,30,300300,5,Kaos Polo Pria
9813318085,HOOLIGANS Polo Shirt Paolo - Navy,61,31,132000,5,Kaos Polo Pria
12109085362,KLAMBEN Kaos Kerah Bigsize Dewasa Etnic Batik Print Wajik Navy,19,0,87500,5,Kaos Polo Pria
11545501712,ootdsupply Oversize Polo Shirt Culture Black l Kaos Oversize Unisex,12,0,225000,5,Kaos Polo Pria
11278069395,POLO 36 SHIRT Custom Fit 100% Cotton - Pink,35,62,209700,5,Kaos Polo Pria
504573117,VM Polo Shirt Polos Kaos Krah Basic Simple Lakos Abu Muda / Light Grey,93,21,59000,5,Kaos Polo Pria
7119938217,Cottongo Polo Shirt White,147,0,129000,5,Kaos Polo Pria
14182994124,OOTDSUPPLY Oversize Polo Rugby Shirt V.4 WIld Star Black Grey | Kaos Polo Pria dan Wanita PSRGB-V4005,7,50,125000,5,Kaos Polo Pria
12789009921,Kaos polo akhlak bumn,4,0,65000,5,Kaos Polo Pria
12641919047,Polo dry fit seamless lengan panjang tanpa jahitan original import,9,0,246000,5,Kaos Polo Pria
44280488,Polo Shirt/Baju berkerah WILSON TENIS,5,0,120000,5,Kaos Polo Pria
12014757312,Adidas original male pique 3s polo navy white bnwt,27,0,208000,5,Kaos Polo Pria
11891433328,SANVANINA Polo Shirt Pria Korea | Kaos Polo Shirt Cuba Polo ,69,0,108999,5,Kaos Polo Pria
13106420803,FPR Multicolor Stripe Collar Polo Shirt,21,0,479000,5,Kaos Polo Pria
12425017466,BELIEVE POLOVERS REGULER POLO PREMIUM,8,0,110000,5,Kaos Polo Pria
2360014938,KAOS - BAJU BORDIR POLO SHIRT AMG MERCEDES BENZ - POLO SHIRT MERCY,10,0,50000,5,Kaos Polo Pria
14167110738,JERSEY TIMNAS INDONESIA HOME AWAY 2024 / 2025 ERSPO PRINTING MERAH PUTIH WORLD CUP TERBARU,13,0,70000,5,Kaos Polo Pria
15013938700,Hush Puppies Kaos Polo Pria Eleveted Class Polo Black,1,50,299500,5,Kaos Polo Pria
11722311435,lacoostee pique polo smart paris navy authentic,9,10,899000,5,Kaos Polo Pria
13630992146,H&M Slim Fit Polo Shirt - Navy Blue,19,0,128000,5,Kaos Polo Pria
5978253801,MATSUDA Kaos Polo Shirt Pria Kerah Kushima,1766,64,81884,5,Kaos Polo Pria
12069462522,Scratchline Pure Ease Polo Shirt - Navy  Kaos Polo Pria dan Wanita,17,39,129000,5,Kaos Polo Pria
2483116748,LGS - Kaos Polo - Coklat - Regular Fit - CTS.225.M2217.04.C,10,50,213950,5,Kaos Polo Pria
10949908778,Kaos Polo Pria SINONIMS Classic Polo Shirt Steel blue,144,41,118000,5,Kaos Polo Pria
2812558692,"Polo shirt cotton pique polos uk. M,L,XL warna abu tua",100,0,48000,5,Kaos Polo Pria
2120775911,KAOS KERAH POLO SHIRT PRIA T shirt bmw m power,119,0,115000,5,Kaos Polo Pria
1925693978,Mills Bali United Polo Shirt 17004BU,46,0,279000,5,Kaos Polo Pria
12961033119,Jack Nicklaus Opera Polo Shirt Pria Regular Fit Dark Brown,14,50,329500,5,Kaos Polo Pria
15150514584,Kemeja Polo - Cozy Polo Shirt,94,33,189584,5,Kaos Polo Pria
13119546199,polo Shirt Polos Pria wanita lengan pendek atasan unisek Kaos kerah polo polos wanky sporty bahan polo dan laos terbaru murah wanky polosan sporty terlaris,15,5,56905,5,Kaos Polo Pria
13621149528,Kaos Hammersonic 2023 Rare Edition Builtup Tanpa Jahitan Samping Hammer Sonic,1,9,109063,5,Kaos Polo Pria
3951676500,KAOS POLO BAHAN NYLON FIBER / MOTIF CORAK 3 VARIASI,0,0,131701,0,Kaos Polo Pria
7702442482,Cottongo Polo Shirt Black,247,1,127710,5,Kaos Polo Pria
13063040157,MT-0163 Basic Polo Pria Dropneedle Knit,60,0,129000,5,Kaos Polo Pria
7772220912,Kaos Wangky Cartenz Tactical Bellinzona,36,0,395000,5,Kaos Polo Pria
11559947225,Kaos Custom Logo Dan Nama Sablon Kaos Kerah Polo Lengan Panjang,16,0,75000,5,Kaos Polo Pria
8972223381,TSHIRT SHAGGYDOG - TS SCOOTER BOYS LONG SLEEVE WHITE,25,10,171000,5,Kaos Polo Pria
7571299996,Kaos polo korea saku dewasa motif batik crocodile 02 | kaos kerah pria,194,0,49800,5,Kaos Polo Pria
2030114459,KAOS POLO NIKE BAHAN POLIESTER FIBER // 3 VARIASI WARNA,73,0,151400,5,Kaos Polo Pria
12133567108,Noir Sur Blanc Men Basic Polo Knit Denim,0,15,255000,0,Kaos Polo Pria
13546929128,The North Face Men S/S Logo Polo-NF0A87UX8K2,1,50,595000,5,Kaos Polo Pria
2630473233,Kaos Polo pria NIKE NSW SPE MATCHUP PQ.CJ4457-010 AFO,2,0,549000,5,Kaos Polo Pria
15030708339,BlueButton Polo Shirt Beige,14,61,145000,5,Kaos Polo Pria
12373131516,Kaos polo shirt kerah lakos polos pria wanita lengan panjang,288,1,38610,5,Kaos Polo Pria
12042785894,BROGUY Kaos Polo Shirt Pria Kerah Lengan Pendek Zipper - Dark Brown,92,0,99000,5,Kaos Polo Pria
13701011437,polo long sleeve korean style kaos polo pria dewasa slimfit elastis premium distro abu tua polos,14,20,87920,5,Kaos Polo Pria
13252496908,TBN Pique Pocket Polo Shirt,12,0,479000,5,Kaos Polo Pria
15394921964,B*SS MEN POLO PADDY PRO BLACK (100% AUTHENTIC)- POLO PRIA REG FIT STRECTH,2,0,1270000,5,Kaos Polo Pria
12623686290,polo shirt Land Rover Deffender Baju Offroad Jeep kaos kerah otomotif,3,0,150000,5,Kaos Polo Pria
6701130551,FRED PERRY Black Polo T-Shirt - White and White,24,21,1099000,5,Kaos Polo Pria
12777689588,MILLS Polo Shirt Sport Style Revenge 4.0 17111,47,0,349000,5,Kaos Polo Pria
10783383892,LGS - Kaos Polo Casual Pria Bermotif Warna Abu-Abu CTS.220.M2864.01.C,3,50,234950,5,Kaos Polo Pria
1523494336,KAOS POLO MERAH MARON - POLO SHIRT MARUN - KAOS POLOS MERAH MARON,132,0,34000,5,Kaos Polo Pria
3946036304,KAOS POLO ABU MISTY -KAOS PRIA - KAOS POLOS ABU KAOS MURAH POLO SHIRT,168,0,33000,5,Kaos Polo Pria
8752526236,PLCLXVII - Polo Shirt Pria - Logo Besar 1002,89,45,145750,5,Kaos Polo Pria
11712155623,Malibu Oversize Polo Shirt Kerah Relax,57,66,69000,5,Kaos Polo Pria
5256057631,Emba Classic-Biogo Hitam Kaos Polo Pria Lengan Pendek,9,21,149900,5,Kaos Polo Pria
5736651042,Kaos polo shirt lengan panjang | kaos kerah pria | kaos seragam polos,217,0,37800,5,Kaos Polo Pria
1247525023,Kaos Polo Shirt Custom Design Logo Sendiri Bordir/Sablon Satuan,1700,4,75636,5,Kaos Polo Pria
13884830027,Baju Kaos Kerah Short Sleeve Polo Shirt Mustard  | Kaos Krah Ukuran Jumbo XXL 2XL XXXL 3XL XXXXL 4XL | Big Size Polo Shirt Lengan Pendek Branded,56,68,73800,5,Kaos Polo Pria
14820022846,Forever21 Waffle Knit Polo Shirt,10,0,179000,5,Kaos Polo Pria
14766915305,Polo shirt Kaos Kerah Team Toyota Gazoo Racing,5,0,125000,5,Kaos Polo Pria
2190040132,kaos pria polos kerah wangki,107,0,29000,5,Kaos Polo Pria
2772458908,Kaos Kerah Polo NSA ( New States Apparel ) 8100 - S M L XL XXL XXXL,778,0,82000,5,Kaos Polo Pria
13027555533,Puddinglane  Polo Shirt Stripe Oversize Ellios,5,57,79900,5,Kaos Polo Pria
6913774767,Kale PARKER / Kaos Polo Pria / Kaos Pria / Kaos kerah,246,15,123000,5,Kaos Polo Pria
13241020063,Luigi Long Sleeve Polo Shirt,16,11,252760,5,Kaos Polo Pria
13284216368,Fairgoods X Hilight Polo Shirt Pria Waffle Knit Relax,11,66,69000,5,Kaos Polo Pria
10635815492,Kaos Krah Polo Shirt Pria Dewasa Lengan pendek Berkerah,62,12,87120,5,Kaos Polo Pria
14700644704,Poloshirt Wondr BNI 46 Kaos Official Bank BNI,9,0,80000,5,Kaos Polo Pria
12618686652,Hammer Man Polo Basic Online  Z1PO001M1,52,0,249900,5,Kaos Polo Pria
2988147955,Johnwin - Kaos Casual Polo Pria - Biru - Kantong - ATS.625.M375.01.CSS,7,50,153000,5,Kaos Polo Pria
13062434949,Fred Perry Twin Tipped Polo Shirt Black / Shaded Stone Original,13,0,900000,5,Kaos Polo Pria
14236863627,Otsky Polo Shirt Pria Rail Knit New All,20,63,99900,5,Kaos Polo Pria
10858395632,kaos polo luis vuitton,1,0,799999,5,Kaos Polo Pria
14489249158,Kaos Polo Pria Hush Puppies Basic Polo Shirt Kaos Kerah Pria,27,0,80000,5,Kaos Polo Pria
13293023947,Kaos polo shirt team Ducati gresini Racing,3,0,85000,5,Kaos Polo Pria
803648803,POLO SHIRT KERAH PRIA POLOS UKURAN JUMBO XXL,219,0,29900,5,Kaos Polo Pria
11740183970,Adidas Polo Shirt Aeroready Essentials Pique 3-Stripes Navy ORIGINAL,3,0,355000,5,Kaos Polo Pria
10624161672,LGS - Kaos Polo Casual Pria Motif Polos Saku Kancing CTS.224.M2430.02,1,50,179950,5,Kaos Polo Pria
12768600883,ARNOLD PALMER POLO SHIRT BASIC NAVY PRIA - P-XXXA08-M9,10,54,259900,5,Kaos Polo Pria
13712834617,Kaos Polo Abercrombie & Fitch Signature Icon Shirt Original - Black,8,10,269800,5,Kaos Polo Pria
15409021982,Polo Harley Black Blue USA,6,0,325000,5,Kaos Polo Pria
5556758002,Kaos Hush Puppies Basic Polo Shirt,25,0,80000,5,Kaos Polo Pria
3940242002,MANZONE Poloshirt lengan panjang pria GENARO-BLACK,2,60,95758,5,Kaos Polo Pria
2225570329,AIA - Poloshirt,44,0,96500,4,Kaos Polo Pria
3067937317,HOOLIGANS Polo Shirt Linea 22.2 Navy,60,32,132000,5,Kaos Polo Pria
8860810555,Corduroy Shirt Polo Big Size Jumbo M-XXXXXL Reevantstore,16,0,319200,5,Kaos Polo Pria
2390921774,Kaos polo shirt polos | kaos kerah pria seragam polos hitam dan putih,150,0,31800,5,Kaos Polo Pria
14247590633,Executive Slim Fit High Neck Vest 1-VSICRT124F390 Dusty Blue,1,25,299925,5,Kaos Polo Pria
12685917082,PIERROX Polo Shirts - 1308723HD,0,50,299000,0,Kaos Polo Pria
12674358830,Tommy Hilfiger Black Tshirt Formula One Mercedes Team Import,6,10,387396,5,Kaos Polo Pria
