id,name,countReview,discountPercentage,price,rating,category
14015056762,KITC x AIRIE Bundling Special Package,14,17,250000,5,Kaos Pria
15057185811,TRNOVR Kaos Anime | Takenori Akagi | Slam Dunk Akagi,11,0,90000,5,Kaos Pria
7503396817,Aerostreet T Shirt Oversize World Chaos Hitam Kaos T-Shirt FADAA,161,53,84506,5,Kaos Pria
13123673142,Kaos Patagonia Logo Responsibili Tee Tshirt Branded New Original,13,40,239600,5,Kaos Pria
11509921721,Kaos Distro Pria Wanita 24S TEBAL - Kaos 100 3 Pcs Explore Lost,334,0,99000,5,Kaos Pria
2161107496,"KAOS RAGLAN PRIA POLOS\ KAOS RAGLAN PRIA LENGAN 3\4, ATASAN PRIA",120,0,15000,5,Kaos Pria
11722899014,"Kaos Polos   RINGER TEE "" LIST HITAM "" Cotton Combed 24s",13,0,36000,5,Kaos Pria
13130421452,KALE Dios - Kaos - Tshirt Pria Premium Cotton - Katun Lengan Pendek,372,0,135000,5,Kaos Pria
13043563919,VIERRATALE TEES - HEROES,6,0,250000,5,Kaos Pria
12737372637,HIERARCHY STUDIOS Spellbound 2.0 - White Wicked Oversized Mesh Jersey,2,0,500000,5,Kaos Pria
11510226528,Ludenssect - Death Silent Longsleeve T - Shirt Black,15,34,115000,5,Kaos Pria
9868771602,Kaos Polos Militer - Baju Pria Army - Kaos Lengan Pendek Pria Tactical,146,0,51990,5,Kaos Pria
5008498292,UNKL347 T-Shirt Hitam Bahan Combed Motif Simpel LOGS,259,0,185000,5,Kaos Pria
13481978036,Baju Kaos Polos Model Standar Basic Pria dan Wanita Pushop Unisex Salem,32,77,33999,5,Kaos Pria
7101726804,KAOS KESSOKU BAND BOCCHI THE ROCK | BAJU ANIME PREMIUM QUALITY T-SHIRT,210,0,85000,5,Kaos Pria
12939346341,Onoma - Reguler Tshirt Wash Dino Green Dark green - Kaos,89,54,115000,5,Kaos Pria
13150596580,Insurgent Club - Tshirt Kaos Chrome Club White,35,15,170000,5,Kaos Pria
13290187307,KAOS Oleh-oleh Amerika Boston - Baju Souvenir Boston Massachusetts USA Batch 5,25,0,50000,5,Kaos Pria
7782667806,Kaos dewa 19 format masa depan Combed 24s,0,0,95000,0,Kaos Pria
13515392710,Aerostreet T Shirt Efron Merah Kaos T-Shirt Tshirt ABAAA,44,50,79900,5,Kaos Pria
13099182739,Kaos Basic Katun Tencel (TENCEL Cotton Modal),11,0,325000,5,Kaos Pria
8630894934,Cotton Goods Kaos Polos Oversized Basic 30s,94,65,59900,5,Kaos Pria
5239251135,Aerostreet T Shirt Hanoman Krem T-Shirt Tshirt ABDAA,519,50,69900,5,Kaos Pria
14350772361,Cotton Goods Kaos Boxy Polos 20s Nyaman Tebal Adem,5,67,66900,5,Kaos Pria
15288043347,KAOS BAJU MESSI ARGENTINA T-SHIRT FOOTBALL TEE OVERSIZE | LMM PRG,8,0,210000,5,Kaos Pria
12469654485,Repsol Merchandise Official Marc Marquez Jersey,0,0,350000,0,Kaos Pria
11881333156,Hi VABA Oversized Fall With My Soul Tshirt | Kaos Streetwear Unisex Te,1,0,75000,5,Kaos Pria
9689255406,OSSU Tshirt Coldplay Reguler Heavy Cotton,7,0,225000,5,Kaos Pria
15063286659,Arcteryx Solarium Graphic T-Shirt,4,0,279000,5,Kaos Pria
14890435473,BBTU - T-SHIRT - EFEK RUMAH KACA FCF,0,0,155000,0,Kaos Pria
6968937691,CHEVRON Dark Navy Graphic Tee - Kaos Pria Lengan Pendek Edwin Jeans,27,73,79900,5,Kaos Pria
15225738619,"SUPERMASSIVE ""LONGSLEEVE RABBIT AND WHEELS""",37,0,350000,5,Kaos Pria
1395719865,Human Greatness Midweight T-shirt Olive,289,30,105000,5,Kaos Pria
14159824827,KAOS DISTRO MOTIF KEMERDEKAAN INDONESIA PULIH ORI BY HAENHA,38,25,90000,5,Kaos Pria
1706912795,PARSEL RAMADAN - W2 / kaos pria tangan panjang / v neck / kaos terlari,389,0,23000,5,Kaos Pria
13930626011,HLPD WeirdWorld | Baju Kaos | T shirt | Boxy Tee - Spirit,12,55,89000,5,Kaos Pria
6879616234,OFF SEASON T-SHIRT DISTORTION MILES,28,0,149000,5,Kaos Pria
2001839437,KOZE - Premium Comfort Black - Kaos Polos,1389,67,49500,5,Kaos Pria
10462988956,BAJU CAMO/PAKAIAN HUNTING/BAJU BERBURU/KAOS KAMO,160,0,115000,5,Kaos Pria
14696871692,TSHIRT TIGAPAGI - ROEKMANA'S REPERTOIRE,2,0,225000,5,Kaos Pria
1272064374,HOOLIGANS |T-SHIRT- HLGN ARTIFICIUM,290,49,94000,5,Kaos Pria
12442236471,[Pre-Order] Kaos Tactical Badmoment 1,4,13,119190,5,Kaos Pria
14396083339,Tshirt Typo Levine Black Thanksinsomnia,1,67,100000,5,Kaos Pria
11741185739,Arcteryx Endorphin Rock Climbing T-Shirt,12,0,279000,5,Kaos Pria
6200866172,Kaos Polos Cotton Combed 24S Merchons / Merchcons Premium Hitam,53,0,45000,5,Kaos Pria
10621071729,Crop Boxy Tee Fillingstreet - Lucaa,43,0,115000,5,Kaos Pria
2994529445,Paramesti Kaos Wayang Ki Semar,70,2,97020,5,Kaos Pria
3157962248,Sipolos Kaos Polos Earth Tone Lengan Pendek Cotton Beige,221,53,69900,5,Kaos Pria
14977191928,Hammer Man T-shirt Grafis Online H1TI034N1,20,57,99900,5,Kaos Pria
10727577723,kaos hard rock original hitam,27,0,135000,5,Kaos Pria
6369144521,KAOS - INUL DARATISTA & ADAM SUSENO • concept tee,22,0,175000,5,Kaos Pria
1576694706,Kaos Polos Warna Coklat Tua Bahan Premium Cotton Combed 20s,135,0,58750,5,Kaos Pria
1905697257,kaos NIRVANA 4 - BLEACH / kaos nirvana nevermind / smells like teen,116,0,77500,5,Kaos Pria
10429218729,Tshirt Ducati Lenovo MotoGP 2023 F Bagnaia Pecco Import Quality,17,20,294400,5,Kaos Pria
12231700619,Executive Mock Neck Long Sleeve T-Shirt 1-TLICRT223K460 Black,12,25,134925,5,Kaos Pria
11870384326,T-SHIRT KAOS PLESETAN PS PINJAM SERATUS BAJU KATA KATA KATUN COMBED30s,75,0,49500,5,Kaos Pria
12038604376,Kaos Polos Cotton Combed 30S Lengan Pendek Dewasa -Earth Tone Ver-,106,0,30000,5,Kaos Pria
11085166613,Wellborn Fukazi LS T-shirt Olive,138,34,145000,5,Kaos Pria
1261059985,Real Heavy SS Pocket T Shirt 16s White - Kaos Kantong Putih,635,0,125000,5,Kaos Pria
11977918259,Moxie Kaos Stardust Unisex Katun Combed 24s Putih White T-shirt,54,63,55800,5,Kaos Pria
3225027557,Kaos Kurta Polos Lengan Pendek By Zain Moslem Apparel,24,0,90000,5,Kaos Pria
9293055650,Baju Barong Bali Jumbo,27,0,42000,5,Kaos Pria
13936397817,Kattoen Everlasting series - Kaos Polos,33,47,68900,5,Kaos Pria
8867828301,Vapemurah OXVAXLIMSQ lengkap murah podstik vapepods vapezooid mini new,6,0,280000,5,Kaos Pria
12055723298,Kaos Pria Wrangler Atasan Lengan Pendek Oblong Distro Laki Pakaian COD,35,15,17000,5,Kaos Pria
7780357124,Kaos Polos Cotton Combed 30s 24s,89,0,34000,5,Kaos Pria
6872324339,THE STROKES RINGER T-SHIRT | KAOS MUSIK,15,5,114000,5,Kaos Pria
14128464965,Tshirt Typo Fumika Black Thanksinsomnia,12,67,100000,5,Kaos Pria
2111831218,LONGSLEEVE DARK GREY,84,0,74900,5,Kaos Pria
1366691038,The Executive Basic V Neck T-Shirt 1-TSIBSC519O043 Dark Grey,221,53,69900,5,Kaos Pria
15576806158,Kaos Basic Katun Tencel (TENCEL Cotton Modal) BLACK,1,66,110500,5,Kaos Pria
13045685895,Madless Kaos Pocket Pria | POCK 01,31,59,69900,5,Kaos Pria
10742597447,kaos 4 pcs 100 ribu murah Pocket Saku Polos Semi-katun 24s,267,0,100000,5,Kaos Pria
14990745341,Kaos Baju Teknisi CCTV Gratis Nama Kamu Lengan Panjang Kaos Distro,5,0,68000,5,Kaos Pria
14735907061,FortKlass Kaos Oversize Rantai T-Shirt Cowo Premium Kaos Big Size,177,71,62000,5,Kaos Pria
12080082790,Bluesville - Manifesto IndiBlue Tshirt - Kaos Pria,6,15,262650,5,Kaos Pria
2052325517,Bloods Tshirt Kaos Rummored Black,307,0,145000,5,Kaos Pria
1970295837,kaos pemuda pancasila terbaru,70,0,22500,5,Kaos Pria
7264683288,Kaos ProRock Taft X Dirt Everyday Official Merchandise,8,0,200000,5,Kaos Pria
2364315361,M231 T-Shirt Polos Oversized Pendek Khaki 1973H,95,53,94000,5,Kaos Pria
12800553750,Kaos Couple Pentol | KP-PN-01,19,30,89600,5,Kaos Pria
15012572310,HOOLIGANS T-Shirt SC Frame Black,13,51,93000,5,Kaos Pria
12021699341,Kaos IKN Nusantara,14,0,65000,5,Kaos Pria
2928123154,KAOS BIG SIZE M L XL 2XL 3XL 4XL 5XL 6XL oversize panda jumbo,33,0,90000,5,Kaos Pria
13042124073,kaos t-shirt anak astro bot playstation,4,0,95000,5,Kaos Pria
12246026721,Baju Hitam Pria Kaos Band A tribute to KLa Project / T-Shirt Musik,6,0,99000,5,Kaos Pria
12053256224,3Second x RRQ Kaos Pria Relaxed Fit Katun  Keep Playing C131023,3,36,159000,5,Kaos Pria
13718022052,The Powerpuff Girls x Acmedelavie Big Printing Artwork T-Shirts Charcoal,3,25,825000,5,Kaos Pria
2578144342,KAOS BASIC BIOWASH - Green Olive [ COMBED BIOWASH 30s ] | ULTRA SOFT,78,0,70000,5,Kaos Pria
13142667269,Liquid Krusty Crepes V6 freebased botol 60ML creamy Taro Ice Cream vapoor vapepods elektrik,15,0,143690,5,Kaos Pria
14463710117,Trondheim Kaos Saturday Tennis Hitam,12,76,65000,5,Kaos Pria
2334806738,Common Defect Body Fit T-Shirts,229,0,45000,5,Kaos Pria
6005637613,Kaos Polisi Kerah Pendek XXL | Baju Dalam Polri Bahan Polyester Double,100,0,29810,5,Kaos Pria
11116254729,PROMO HEMAT 100 RIBU DAPAT 6 KAOS MOTIF DISTRO DEWASA L XL,236,11,16900,5,Kaos Pria
4863182921,Kaos Film The Warriors Movie T-shirt,46,25,119000,5,Kaos Pria
12432594439,SANVANINA Baju Kaos Denver Knit Waffle Shirt,23,50,88900,5,Kaos Pria
6464966342,DEUS - ADDRESS BALI OG,47,0,425000,5,Kaos Pria
12570717827,Gloaming Tshirt Oversized Cotton Australia Coolbreeze 16s Black,2,46,119900,5,Kaos Pria
652631162,Kaos Polos 16s Real Heavy Goods Navy - Kaos Polos Navy Katun,468,0,120000,5,Kaos Pria
13939000072,W.Essentiels x One Piece Gear 5 F.C Player Issue Jersey #56 Luffy Home,24,0,421000,5,Kaos Pria
12517479041,Buy 1 Get 3 Ngab Kaos Distro Take Off Landing Space Invasion BD011,14,0,560000,5,Kaos Pria
13868015438,Teenage Death Star - Skill Is Dead,16,0,200000,5,Kaos Pria
12962910075,Kaos Polos Soft Cotton Zelus Apparel  Build Up (Part 2),140,60,38000,5,Kaos Pria
1782504433,Kaos Pria The Beatles,13,0,17000,5,Kaos Pria
3388312290,Tendencies Tshirt Addicted,114,59,81600,5,Kaos Pria
13117531403,KAOS OBLONG TSHIRT PRIA POLOS COTTON UNISEX WARNA CIKLAT COKELAT B,67,0,16900,5,Kaos Pria
10686053931,"Ossu Official Kaos ""BMTH -Sempiternal"" Reguler T-Shirt",18,0,155000,5,Kaos Pria
10833318797,Dobujack Tshirt Healer Black Tees,28,60,88000,5,Kaos Pria
12875621285,Kaos Kata Tahanan Istri Males Ribut,18,30,89600,5,Kaos Pria
13145331686,Tshirt MATA PISAU x JENNY Logo,4,0,208390,5,Kaos Pria
12623325890,Wellborn Fukazi LS T-shirt Washed White Black,16,34,145000,5,Kaos Pria
15730005165,kaos harley davidson depan belakang,53,0,110000,5,Kaos Pria
14583854663,Kaos Pria PEJUANG ANTI WARISAN,7,0,27000,5,Kaos Pria
2677480034,kaos BEHEMOTH ANGELUS SATANI Tshirt behemoth black metal burzum mayhem,96,0,77500,5,Kaos Pria
7439170867,KAOS TOKOH TAN MALAKA I REKAMJEJAKMERCH,7,0,85500,5,Kaos Pria
13003604262,hoodie lengan pendek kaos topi big size all size atasan pria wanita,85,0,120000,5,Kaos Pria
15140161603,Tshirt Dua Lipa - Radical Optimism Album Art & Tracklist Original Official,7,0,295000,5,Kaos Pria
11707883097,Mnst T-shirt Oversize | Kaos Polos,254,62,55000,5,Kaos Pria
11871056818,Tetestuang Kaos Harapan Ibu | Berhasil ataupun gagal - QTS 9,1,0,150000,5,Kaos Pria
12299183789,Hooligans T-Shirt Stripe Strepen Dusty Blue White,99,51,94000,5,Kaos Pria
9557927238,Kaos Pria Wanita Scuba Diving - Love | Seriboo Store,8,0,149000,5,Kaos Pria
6474657933,Someone T Shirt Singlet Glow In The Dark Black 260S Apocalypse,11,0,170000,5,Kaos Pria
2076132693,Longsleeve Deadsquad,66,0,90000,5,Kaos Pria
2101972659,M*rcelo Burlon FW21 Camou Wings Tee White/Army 100% Authentic,0,0,2499000,0,Kaos Pria
13975405379,Ngab Kaos Baju Distro Oversize Physicist Unisex OVZ022 Hitam Pria Wanita Cotton Combed 24s,13,67,99999,5,Kaos Pria
14415092553,Straight Vision - Gefion Tanktop | Kaos Singlet | Kaos Oblong,3,60,99900,5,Kaos Pria
14760204595,KAOS POCKET SAKU MBA ORIGINAL VOL 2 Cotton COMBED 24s Unisex Pria Baju Distro Katun Polos,2,58,54558,5,Kaos Pria
4266395311,Kaos Polos SINONIMS Premium Basic T-shirt Maroon,67,19,81000,5,Kaos Pria
492099019,Tanaman heliconia pisang pisangan,151,0,5500,5,Kaos Pria
11958440754,WEEZER - BLUE ALBUM 1994 TSHIRT BLACK,4,10,315000,5,Kaos Pria
3174222557,Kaos Polos Cotton Combed Premium 24s Unisex Tebal Termurah,67,0,32000,5,Kaos Pria
14939089838,Deliwafa - Wih Hebat | T-Shirt Regular | Kaos Lengan Pendek | Baju Pria Wanita,5,0,85000,5,Kaos Pria
500455536,Kamengski - Cuci Gudang Black Tee,232,0,160000,5,Kaos Pria
2111792513,kaos distro pria original longline lengan pendek improve premium,213,0,69900,5,Kaos Pria
11541570271,Kaos Polos Pocket Oversize Pria Kaos Polos Long Sleeve Pocket T-shirt,56,46,95000,5,Kaos Pria
6995234174,Eternal Sunshine of the Spotless Mind - Lacuna Inc Movie Shirt,46,13,139000,5,Kaos Pria
10512792090,Baju Kaos Pria Atasan Oblong Cowok Cafu Lengan Pendek Premium,519,0,52000,5,Kaos Pria
6952004954,Infinide T-Shirt Kaos Polos SAKU MAROON Coton Combed 24s Premium,29,0,50000,5,Kaos Pria
3851556921,Baju Kaos diskotik STADIUM hitam,7,0,120000,5,Kaos Pria
1810277394,Tambahan Sablon Custom Satuan Bebas Desain Tulis di Note Taruh Dimana,247,0,10000,5,Kaos Pria
12937321131,Frasser Promo Kaos Polos Unisex Soft Super PE Kaos Oblong Premium 02,41,80,15990,5,Kaos Pria
1834010112,Kaos Solana Cryptocurrency 467,9,0,76000,5,Kaos Pria
11583695098,Kaos BRING ME THE HORIZON PUTIH 2 THIS IS'NT LOVE Premium tshirt bmth,73,0,77500,5,Kaos Pria
12908861652,Flexclothsby - Kaos Camoblu Bear Waistbag - Baju Pengganti Tas ,20,0,114000,5,Kaos Pria
1816256807,Human Greatness Midweight T-shirt Baby Blue,191,30,105000,5,Kaos Pria
14142006593,Sun Eater - HCTS 2024 General Admission - T-shirt - Black,7,0,199000,5,Kaos Pria
4698469688,Monkey D. Luffy Gear 5 Gomu Gomu no Lightning Anime One Piece Kaos,341,26,130000,5,Kaos Pria
11804130531,T-shirt Unisex Deliwafa Authentic,34,0,90000,5,Kaos Pria
15008325102,UNKL347 T-Shirt Putih Bahan Combed Motif Simpel ROOR,9,75,66000,5,Kaos Pria
2015089291,KAOS BIGSIZE PUTIH 2XL 3XL 4XL 5XL 6XL,732,0,85000,5,Kaos Pria
10976680814,Ageless Galaxy Script 014 - Brick Red,0,0,320000,0,Kaos Pria
11312264642,Pojok Busana Kaos T-Shirt Polos Basic Putih Hitam Warna Warni Oblong,87,80,24950,5,Kaos Pria
2059120987,Kaos Musik Flash Yang Dipakai Freddy Mercury dari Queen,51,0,65000,5,Kaos Pria
5361009190,Aerostreet T Shirt Morpho Menelaus Hitam Kaos T-Shirt AADAA,1252,53,65706,5,Kaos Pria
13653216251,"Kaos oleh - oleh Korea, Seoul Pakai tag label (Negara Asal) Varian Black banyak varian gambar bahan cotton combad 30s",25,5,51300,5,Kaos Pria
14739909087,T-shirt Kaos Lifework Bulldog Motif Sketsa Lengan Pendek Full Tag/Kaos Unisex Full Cotton Combat (Sablon Depan Belakang ),7,5,61750,5,Kaos Pria
10975014710,Kamengski - Sunat Laser Tee,111,0,170000,5,Kaos Pria
12437400216,T-shirt Band Pure Saturday Discographic,15,0,79500,5,Kaos Pria
9691152574,TOMMY HILFIGER - NATHAN TEE T-SHIRT-Bright White,1,0,890000,5,Kaos Pria
10480119904,Zalmore Basic Men Oneck T-Shirt Premium Cotton - Kaos Polos Pria,1811,47,47500,5,Kaos Pria
12334626731,Aloomni T-shirt Father Element,16,0,149000,5,Kaos Pria
12963808672,Human Greatness Waffle Wimbledon Misty M71 Shirt,58,55,150000,5,Kaos Pria
11927833803,Onoma - Falling In Net Wash Oversized T-shirt,139,50,147000,5,Kaos Pria
14851686619,LAWLESS JAKARTA - IRON EAGLE T-SHIRT - BLACK,14,20,207200,5,Kaos Pria
12353940434,RHID - T-shirt Kaos Polos White Putih Jumbo,15,71,49900,5,Kaos Pria
7782538376,Kaos Band - Bad Religion - Live 1980 Official Merchandise,18,0,329000,5,Kaos Pria
7532098602,"Kaos lives-kaos pria import, kaos oblong, kaos branded, T-shirt",56,0,79000,5,Kaos Pria
1850980484,tshirt royal enfield,9,0,125000,5,Kaos Pria
8009667853,DEATHCULT - Alien Big Chap Xenomorph - tshirt,17,0,215000,5,Kaos Pria
13752733027,Exploded Console Series - XBOX T-Shirt I RaisinKats by The Lazy Monday,24,0,179000,5,Kaos Pria
9872757449,KAOS CUSTOM SABLON - BAJU CUSTOM FULL COLOUR - KAOS PRINTING,1939,0,20000,5,Kaos Pria
15012896096,Tshirt Beyond Success TBTN Apparel Tshirt Kaos GBI Rayon 18 Kaos BS Polos,7,0,85000,4,Kaos Pria
13150834429,CDG Play Golden Heart Patch T-Shirt,0,0,279000,0,Kaos Pria
13564226550,KOZE - Premium Comfort Dark Green T-shirt - Kaos Polos Hijau Pekat,55,67,49500,5,Kaos Pria
12485023031,T-shirt Berita angkasa - Artificial Satellite,23,0,195000,5,Kaos Pria
1211896199,Human Greatness Midweight T-shirt White,401,30,105000,5,Kaos Pria
11873572557,Tetestuang Kaos Pluralisme v11 | Kaos Pluralisme Semar - PLU 11,4,0,150000,5,Kaos Pria
1582726227,Dobujack Tshirt Helena Black Tees,194,52,88000,5,Kaos Pria
3541525974,Human Greatness Heavy Cotton T-shirt Dark Grey,295,33,130000,5,Kaos Pria
8653021673,Tshirt BAP. - Goya (White) - Les Siebon,6,0,250000,5,Kaos Pria
12326556999,Poeticluzien T-Shirt SILENCE SPEAK ( cream ),3,0,84000,5,Kaos Pria
2111958802,MANZONE Kaos Pria Lengan Pendek Slim Fit CHIRAG-Bestbuy-NAVY,67,60,39900,5,Kaos Pria
12860500083,Commongoods Varsity Heavy Weight Regular T-Shirts Series,24,32,95000,5,Kaos Pria
12806508377,T-Shirt The Brandals - 100 KM/JAM,29,0,185000,5,Kaos Pria
2461046901,Bloods Tshirt Kaos Skoc 02 Hitam,113,0,145000,5,Kaos Pria
11772804857,Crop Boxy Tee Fillingstreet - Asterisk,30,0,119999,5,Kaos Pria
13086245008,Famo Kaos Polo Pria Kerah T-shirt Plain Bahan Katun Lengan Pendek OL-C050823,63,52,129000,5,Kaos Pria
2731662444,Baju Kurta Kaos bahan tebal Pria Lengan 3/4 Adem,301,49,50000,5,Kaos Pria
1559900074,KAOS POLOS BIG SIZE 100 % COTTON COMBED 24S ( TEBAL) PANJANG,69,0,55900,5,Kaos Pria
633975439,MAMBA MENTALITY // TRIPLE OVERTIME THRILLER 2019,1100,0,195000,5,Kaos Pria
15012193800,Kale CUCI GUDANG 1 / Promo discount / Atasan pria / Kaos pria / Baju pria,92,64,49200,5,Kaos Pria
13041144216,Nakiri Ayame 1 Million Subscribers Kanji Kaos Ver 2 Cosplay Hololive ,11,0,38500,5,Kaos Pria
2364808015,TURTLE NECK DYLLCO TSHIRT WHITE - KAOS POLOS PUTIH,13,0,149000,5,Kaos Pria
4425698794,Kale Kaos Polos Cotton Combed 30S Lengan Pendek - Arion RED EDITION,902,39,83000,5,Kaos Pria
2533562974,Russ Tshirt Long Sleeve Nirmans White,108,52,115000,5,Kaos Pria
9392929291,Kaos BAND RADIOHEAD Stone Wash Oversize / Tshirt Music ROCK VINTAGE,25,22,128700,5,Kaos Pria
1261126459,Real Heavy LS Pocket T Shirt 16s Black - Kaos LS Kantong Hitam,220,0,140000,5,Kaos Pria
14381858377,Onoma - Oversized Tshirt Wash Romanticize Navy - Kaos,6,50,175000,5,Kaos Pria
11730287807,Broodis Kaos Oversize Pria Stripe Navy MARK Series White Navy Tshirt,168,55,89000,5,Kaos Pria
12618436286,T Shirt Heavyweight 16s Longsleeve - Colourspace - Kraken White,4,0,280000,5,Kaos Pria
3095610758,Kaos Polos Cream Kerah Tinggi Kaos Polos Satpam Kaos Polos Security,48,0,24500,5,Kaos Pria
3350512576,kaos polos oversize lengan pendek Cotton 30s,35,23,23000,5,Kaos Pria
11696162326,Marvel Collection M231 T-Shirt Marvel Spider-Man Sketch Putih 3076,25,77,69000,5,Kaos Pria
12677713508,Insurgent Club - Tshirt Kaos Baloon Type White,15,30,140000,5,Kaos Pria
15223061970,Human Greatness Otter OS T-Shirt Navy HGBasic,36,59,130000,5,Kaos Pria
11180557130,Represent Owner's Club T-Shirt,0,0,319000,0,Kaos Pria
14396266542,ZeroTwentyTwo T-Shirt Trump Album Cover Black | Kaos Pria Hitam Presiden Amerika Donald Trump Shot,10,0,75500,5,Kaos Pria
9837045294,KAOS BASIC POLOS - GREY COMBED BIOWASH 30s Kaos Polos,109,59,62000,5,Kaos Pria
2001862359,KOZE - Premium Comfort White - Kaos Polos,945,67,49500,5,Kaos Pria
13651668854,"Kaos oleh - oleh Jerman, Germany Pakai tag label (Negara Asal) Varian Black banyak varian gambar bahan cotton combad 30s",6,5,51300,5,Kaos Pria
14217467660,WGB Kaos Batik Tikshirt Series Pria Big Size Ukuran Jumbo XXL XXXL,43,37,149900,5,Kaos Pria
14772664892,KAOS BAJU KENDRICK LAMAR DUCKWORTH RAPTEE T-SHIRT OVERSIZE | LMM PRG,4,0,195000,5,Kaos Pria
2213277060,Kaos Pluralisme Religion Tshirt,16,0,89900,5,Kaos Pria
1855354219,Promo KaosYES BS Reject Layak Pakai - Bolong Sedikit / Sedikit Kotor,512,0,10000,5,Kaos Pria
14124125504,Final Fantasy Pixel Remaster XIV XVI Baju Kaos Regular Game UT Shirt UNIQLO UT,16,0,159000,5,Kaos Pria
7641885708,kaos MUNIR masih ingat saya kaos munir marsinah wiji tukul kaos tokoh,0,0,77500,0,Kaos Pria
3493871339,Kaos Pria Bahan Katun Combed Motif Cooffe,564,0,23500,5,Kaos Pria
8886138661,VANS TEE UNISEX MT VANS LS DEEP TEAL - VN00001D60Q,2,54,459000,5,Kaos Pria
6882852811,Aerostreet T Shirt Long Sleeve Urban Hitam Kaos Longsleeve OAAAA,168,50,89900,5,Kaos Pria
2072828047,KAOS POLOS OVERSIZE / KAOS STONE WASH / ACID WASH,87,0,80000,5,Kaos Pria
9057912429,Livescoot Longsleeve - Magine,40,11,165000,5,Kaos Pria
7520574698,PAKET 3 KAOS POLOS PRIA MURAH OBLONG LENGAN PENDEK DISTRO UNISEX,936,38,62000,5,Kaos Pria
14888505529,BBTU - T-SHIRT - ALONE AT LAST FCF,2,0,190000,5,Kaos Pria
1120267019,Kaos Polos Misty Twotone Soft Cotton 30s Pria Wanita,373,0,35000,5,Kaos Pria
13275094777,Jersey Team Falcons AP Bren Game 2024 terbaru,4,0,90000,5,Kaos Pria
11502723580,lunar classic vanilla ice cream liquid salnict Pods Friendly 30ML vape,18,0,115000,5,Kaos Pria
12445102179,KAOS MERDEKA BELAJAR LENGAN  PANJANG / KAOS BAJU MERDEKA MENGAJAR LS,14,0,65000,5,Kaos Pria
12161179778,Kaos Lengan Panjang Exclusive Merchandise SuperMusic x GRRRLGANG,5,21,158000,4,Kaos Pria
4571358961,Cotton Well T-Shirt Oversized Fit | Kaos Santai Polos Katun Combed,66,0,89000,5,Kaos Pria
13080018939,Commongoods Ease Shirt Series,27,51,123000,5,Kaos Pria
12706762034,Heyplain Kaos Polos Hitam Lengan Pendek - Basic T's Cotton Combed 24S,21,34,65000,5,Kaos Pria
7090477669,Benhill X Senikanji - T-Shirt Cotton 20s Combed Pendek Putih A48-29168,2,0,289000,5,Kaos Pria
6383830330,Kaos Jogja Lengan Pendek Tshirt Pria Wanita,60,0,14990,5,Kaos Pria
1615226624,Tshirt THE UPSTAIRS - Energy (Black),77,0,180000,5,Kaos Pria
1253981041,DK Daily Wear Lite Active Wear Green Army,1034,50,83750,5,Kaos Pria
6883353187,Kaos Army Spandex FP 546,51,37,26400,5,Kaos Pria
8917385638,Kaos BASIC Tebal Premium SuperSoft,69,0,132000,5,Kaos Pria
5815090484,Kaos Monkey To Millionaire - The Golden Sound Original Merchandise,4,0,285000,5,Kaos Pria
10970903732,Houseofcuff T-shirt Kaos Hitam Motif Bangau Laut Tersedia Size S-4XL,100,35,85000,5,Kaos Pria
14955858275,Moxie X Egmo Basic Boardshort Cotton Fleece - All Variant,7,69,49800,5,Kaos Pria
8632304280,"Kaos Polos Gildan 76000 Premium Cotton ( COLOR, SIZE XS-XL )",590,38,40000,5,Kaos Pria
2965564377,Three Brothers Teen Version Monkey D. Luffy Portgas D.Ace Kaos Clowor,214,26,130000,5,Kaos Pria
12428962942,Three Pigeon T-Shirt CALIFORNIA - 100% COTTON HIGH QUALITY,0,59,78000,0,Kaos Pria
12100670138,Stussy World Tour Black Tee (100% Authentic),10,0,649000,5,Kaos Pria
1969589777,Baju Barong Dewasa Hitam Khas Bali All Size Ld -+115,165,0,17900,5,Kaos Pria
11778356672,Penjemputan Sesuai Titik V.2 T-shirt,4,3,82450,5,Kaos Pria
5315676050,Kaos LV Branded Fashion Week Pria Wanita,19,0,134900,5,Kaos Pria
13923692044,Jersey Total Journalism x Mills,19,0,349000,5,Kaos Pria
7338817782,Human Greatness Midweight T-shirt Coca Mocha,107,55,105000,5,Kaos Pria
3412212674,Green Day - American Idiot Kaos Band Printed in Gildan Shirt,28,0,179000,5,Kaos Pria
12875915791,Kaos distro 3 pcs N*vada bahan adem untuk pria dan wanita,46,21,98500,5,Kaos Pria
13217382419,SUJI Kaos T-Shirt Basic Regular Hitam Black,344,47,69000,5,Kaos Pria
11765066273,Kaos Katun Bambu Krah V-Neck Super Halus Lembut Kualitas Premium,41,0,74500,5,Kaos Pria
14075706077,Kaos Adidas X Bayern Munchen Pria Original Lengan Pendek,7,40,89900,4,Kaos Pria
15326270841,VLAAR - MENYALA ABANGKUH T-SHIRT - BLACK,3,0,185000,5,Kaos Pria
1500116671,Kaos Cactus Jack McDonalds X Travis Scott,15,0,56000,5,Kaos Pria
11312298075,KAOS POLOS PRIA/WANITA COTTON COMBED 30S REGULER FIT LENGAN PENDEK,38,0,17900,5,Kaos Pria
6303996014,Kain Nike / Billabong Serat Bintik (Dryfit),119,0,72500,5,Kaos Pria
15094912639,KITC Bundling Combo Paket Super Misteri Box,95,45,220000,5,Kaos Pria
7310614461,Horizen T-shirt Indonesia Barong Bali,83,30,69300,5,Kaos Pria
2515454724,Santa Cruz Classic Dot Front T-Shirt Black SC1210101,13,0,395000,5,Kaos Pria
14837402740,"Kaos superhero bumilangit x pixelo [Official License] - tshirt pahlawan gundala, sri asih, godam, mandala anime 90an",3,7,101100,5,Kaos Pria
1808206702,kaos LINKIN PARK - HYBRID TH/ kaos Premium linkin park / oversize,0,0,77500,0,Kaos Pria
9677590677,Livehaf - Cool Enzyme Tee Brown,199,33,59900,5,Kaos Pria
4847733381,UNKL347 T-Shirt Hitam Bahan Combed Motif Simpel KMKM,193,64,66000,5,Kaos Pria
6462456803,KAOS POLOS ORANGE SOLID LENGAN PANJANG COTTON COMBED 30S,20,0,50000,5,Kaos Pria
8222019626,MARKICABS [Suci - Black] Tshirt,67,0,127000,5,Kaos Pria
295124825,Kaos Polos Size XXL XXXL Gildan Premium Cotton 76000 Import Original,281,0,66000,5,Kaos Pria
7426993464,Baju Kaos Jumbo Big Size Pria 2xl 3xl 4xl 5xl 6xl Dan 7xl,290,5,38855,5,Kaos Pria
14787489593,EMCN Oversized Tee Gervonta Tank Davis,7,0,184000,5,Kaos Pria
12462042663,T-shirt kaos VESPA MOTORSCOOTERS PIAGIO high quality,22,0,95000,5,Kaos Pria
2394877877,Owners Tshirt - Delta Black,52,55,89000,5,Kaos Pria
8245501156,GROSIR BAJU KAOS LAPANGAN PDL TACTICAL POLOS OUTDOOR PELINDUNG BUSABAN,105,45,36000,5,Kaos Pria
4653669391,Kaos polos MERCHCONS HEAVY cotton combad 20S TANPA JAHITAN SAMPING,56,0,58650,5,Kaos Pria
11035504121,RPM 2 DC COIL 0.6 OHM ORIGINAL,19,0,40000,5,Kaos Pria
11505251360,Fairgoods Last Stock Crewneck,88,76,59900,4,Kaos Pria
2521749193,KAOS BASIC - MINT FRESH [ COTTON COMBED 30s OEKO-TEX]| Kaos Polos,64,0,65000,5,Kaos Pria
2005709399,Infinide T-Shirt OverSize BIKE Lengan Panjang / Long Sleeve Original,104,0,75000,5,Kaos Pria
14228126969,Kaos IKN Nusantara inonesia Kaos ibu kota NUSANTARA Katun,7,0,75000,5,Kaos Pria
12887572024,COCTEAU TWINS - BRITISH TOUR 94 TSHIRT WHITE,9,10,315000,5,Kaos Pria
9560390765,BAJU 90RB Dapat 6 PCS KAOS DISTRO MOTIF DEWASA BISA UNTUK PRIA WANITA,158,0,49990,5,Kaos Pria
9459061657,KAOS DISTRO PREMIUM CEWE COWO | SIMPSON | A,19,0,100000,5,Kaos Pria
12530340580,Kaos Polos 16s Real Heavy Goods Broken White- Kaos Polos Broken White,140,0,120000,5,Kaos Pria
2339463068,KAOS POLOS LENGAN PENDEK COMBED 30S PREMIUM,4752,0,25900,5,Kaos Pria
14538277138,Skaters T-Shirt Rugby Jersey XF038 White XXL(XF039),15,42,145000,5,Kaos Pria
1572633707,T-shirt kaos TAHANAN KPK high quality,69,0,85000,5,Kaos Pria
7056678117,Insurgent Club - Tshirt Kaos Dont Trust Black,85,25,150000,5,Kaos Pria
13955872030,PROBEER HARD Sleeveless Shirt (Kaos Lekbong Kensi) - Cotton 30 s,20,45,33000,5,Kaos Pria
