id,name,countReview,discountPercentage,price,rating,category
2185750344,Platini Kemeja Putih Pria Lengan Panjang Katun poplin 66301,221,72,139000,5,Kemeja Pria
10745312546,kemeja tactical PO bordir,3,0,125000,5,Kemeja Pria
2103807955,KEMEJA PRIA - ETERNALWORKS STONE NAVY WORKSHIRT - KEMEJA KERJA,50,40,149400,5,Kemeja Pria
1620951975,MOC Kemeja Lengan Pendek Slim Fit Besser-Navy,8,80,89900,5,Kemeja Pria
9176122141,Kemeja lengan panjang pria / cowok warna putih | kemeja polos putih,6,0,62999,4,Kemeja Pria
14493285858,kemeja Quiksilver waterman collection original 0074,4,0,200000,5,Kemeja Pria
12792360034,Kemeja Formal Lengan Pendek Pria Polos Cotton,36,44,89000,5,Kemeja Pria
7825372540,M.Gee - Kemeja Outdoor Lengan Pendek - Trevor C009 White,19,35,285025,5,Kemeja Pria
6646192147,TBN Oxford Striped Grosgrain Armband Classic Shirt,132,10,449100,5,Kemeja Pria
7989874749,"Mickout Shirt ""Cambridge"" White",63,60,111000,5,Kemeja Pria
14955298959,Steady&Slow - Linen Overshirt Jacket | Linen Shirt | Vintage Jacket,4,0,235000,5,Kemeja Pria
7754902117,Kemeja Pendek Pria Cartenz Tactical Assyyria V2,70,0,450000,5,Kemeja Pria
12635182794,Workshirt | Workshirt Noise Project Hitam | Kemeja Workshirt | Kemeja ,3,0,80000,5,Kemeja Pria
1555514780,KEMEJA POLOS - KEMEJA HAWAIAN - CLASSIC SHIRT - KEMEJA PANTAI - RAYON,416,0,89900,5,Kemeja Pria
6849340808,Kemeja Pria Polos Lengan Pendek Putih White OXFORD ada BIG SIZE JUMBO,203,37,94999,5,Kemeja Pria
15435582546,CUTOFF Parker Double Pocket Workshirt Kemeja Kerja Oxford Polos Pria Pendek,62,42,169000,5,Kemeja Pria
14218916715,Baju Kemeja Lengan Pendek Pria Pantai Rayon Adem Hawai Santai Vintage Casual Trendy Pasangan Distro,12,47,79000,5,Kemeja Pria
11522926433,26DD Real pic! 730 083 Kemeja Pria Leopard Tutul,15,0,75000,5,Kemeja Pria
12849012050,Rown Division Official Bowling Shirt - Rowndvsn Kemeja Phoenix Black,10,0,320000,5,Kemeja Pria
14181192638,WOODCUTTER Gingham Shirt Blue,36,0,159500,5,Kemeja Pria
10141626448,BULLS SYNDICATE Shirt Dominique Black,6,20,300000,5,Kemeja Pria
10199960366,Wingman Denim | Sashiko Navy Open Collar S/S,27,0,315000,5,Kemeja Pria
3031769769,Dama Kara Hapsari Ciangi,136,0,259000,5,Kemeja Pria
2319694281,Manzone Kemeja Lengan Pendek KOBE-WHITE,287,25,119900,5,Kemeja Pria
1348844784,Odza Classic Kemeja SLIMFIT Lengan Panjang Pria Polos Ungu Tua B,108,52,119000,5,Kemeja Pria
12867045430,KEMEJA PREPP STUDIO VELOFORE SEERSUCKER LONG SLEEVE SHIRT WHITE,6,0,329000,5,Kemeja Pria
10979524179,kemeja coklat pria slim fit lengan pendek kekinian bahan katun,109,30,69900,5,Kemeja Pria
1981067424,Kemeja tactical w-tac tangan panjang,904,1,113899,5,Kemeja Pria
14111844622,SALE CUCI GUDANG Kemeja Flanel Panjang Slimfit Kemeja Pria,10,68,50000,5,Kemeja Pria
4757796644,KEMEJA TACTICAL SIZE JUMBO (5XL-6XL) | KEMEJA AKTIFITAS LAPANGAN | PDL,36,0,125400,5,Kemeja Pria
14762178125,Cole Fab Solid Kemeja Pria 117060431,3,30,125930,5,Kemeja Pria
6358254768,Noir Sur Blanc Men Bristol Overshirt,29,15,510000,5,Kemeja Pria
11636667772,MANZONE Kemeja Lengan Pendek Pria MZY-ALKA - WHITE,6,67,119900,5,Kemeja Pria
11524982857,Kemeja Pria - Hawaii Doodle Series,20,0,162500,5,Kemeja Pria
14874689208,Amba - Cuban Shirt Bigsize - Kemeja Bigsize,24,0,199000,5,Kemeja Pria
11631329526,kemeja Cartenz (katun street),18,0,155000,4,Kemeja Pria
7214535295,Code Male - Giroud Jacket / Outer Shirt Twill Stretch Hijau Army,8,71,159900,5,Kemeja Pria
13802787892,Dowear Baju Kemeja Motif Cewe Cowo Motif Full Printing Oversize Pria Wanita Outdoor ELEGANT BLUE 241,44,0,79995,5,Kemeja Pria
6852971011,Kemeja Panjang Pria Polos Slimfit Kualitas Distro,330,0,28000,5,Kemeja Pria
8895799947,KEMEJA PREPP STUDIO VELOFORE SEERSUCKER LONG SLEEVE SHIRT BLACK,8,0,329000,5,Kemeja Pria
15431570364,Von Dutch Workshirt 1282 Black,0,20,527200,0,Kemeja Pria
12706930294,SANVANINA Kemeja Panjang Pria Cabana Long Shirt ,50,50,99800,5,Kemeja Pria
6895526219,Brooks Brothers Regular Fit Corduroy Long Sleeve Shirt,51,30,195300,5,Kemeja Pria
9256400287,Kemeja Pria Premium - Nordic pattern 37950617,285,0,162500,5,Kemeja Pria
15155659347,Von Dutch Workshirt 1210 Black,6,20,527200,5,Kemeja Pria
991403119,kemeja panjang polos putih katun slim pria,46,0,55000,4,Kemeja Pria
14199989412,Pojok Busana Kemeja Alisan Oxford Slim Fit Premium Lengan Panjang - Alisan Men Shirt L/S Putih,5,67,199999,5,Kemeja Pria
11719739493,5.11 Tactical Fast - Tac Ripstop & Marksman Long Sleeve Shirt,70,0,249000,5,Kemeja Pria
2646727300,Kemeja PDL Lapangan Tactical Lengan Panjang Outdoor Baju Taktikal Pdh,1494,0,99000,5,Kemeja Pria
15518664835,Kemeja Flannel Uniqlo Original,15,0,229000,5,Kemeja Pria
11907284638,Kemeja Eiger Outdoor quick dry Cliff xtr,37,47,199000,5,Kemeja Pria
2358995852,VM Kemeja Polos Slimfit Tangan Panjang Putih Kemeja Formal Slim,467,26,115000,5,Kemeja Pria
11245974116,5.11 TCTCL Men's Short Sleeve Shirt #2,34,0,249000,5,Kemeja Pria
7111706703,Kemeja Pria Polos Lengan Panjang Lilac Ungu Muda Lylac OXFORD Casual,39,33,99999,5,Kemeja Pria
11400784625,MOC Kemeja Batik Lengan Pendek Pria ENZI-BLACK,15,43,216500,5,Kemeja Pria
13871840692,Arholma Studios - Oversized Shirt 'Mushroom' White,6,5,208430,5,Kemeja Pria
11854679071,VENGOZ Atasan Kemeja Pria Slim Fit - Viscose LS Series Best Seller,91,61,139000,5,Kemeja Pria
11101124928,PNDLTN Longsleeve Flannel Shirt,31,0,279000,5,Kemeja Pria
2260637906,Unionwell Shirt Machine Man Black,145,19,325000,5,Kemeja Pria
15047889409,CUTOFF Irving Overshirt Kemeja Oversized Lengan Pendek Pria,6,39,189000,5,Kemeja Pria
11607436329,Kemeja Pria - Shiny silver colored glitter 2886559,26,0,162500,5,Kemeja Pria
11477022540,M231 Kemeja Pria Basic Polos Hawaii Oversized Pendek Coklat 2190K,56,69,119000,5,Kemeja Pria
14267247185,POLICE Kemeja Polos Basic Cotton Soft Regular Fit Pria Hitam,193,80,79000,5,Kemeja Pria
13106752465,WOOD Short Sleeve Oxford Shirt 2-SSXBSC521O028 Black,14,25,299900,5,Kemeja Pria
15011210705,Brill Eighty Eight - Kemeja Flanel Pendek Premium Black Gray2 88 S2189,4,18,115000,5,Kemeja Pria
9539158941,Kemeja Coduroy Panjang Colourspace - Kierra - Khaki,9,73,110000,5,Kemeja Pria
15008367006,Kemeja Alisan Putih Polos Lengan Pendek Pria Slimfit Bahan Berkualitas Premium,10,0,90500,5,Kemeja Pria
12383685639,Kemeja Flanel Pria WOODCUTTER Cannes Specter Flannel Shirt,44,20,159500,5,Kemeja Pria
13162351847,Troveast Kemeja Outdoor Work Shirt Lead Series Grey,17,55,159000,5,Kemeja Pria
2030437067,M.Gee - Kemeja Outdoor Lengan Pendek - Ranger C001,33,30,313950,5,Kemeja Pria
7630601709,KEMEJA TACTICAL M-TRAC/Kemeja tactical outdoor,26,0,63000,5,Kemeja Pria
2905920732,MOC Kemeja Lengan Panjang Pria Slim Fit FLINT-DARK GREY,40,72,111000,5,Kemeja Pria
13575599966,Kemeja - Escargot Short Sleeve Shirt - Navy,32,44,129581,5,Kemeja Pria
12851388664,FMC Kemeja Jeans Loose Denim Shirt American Heritage FMC021123,7,0,429000,5,Kemeja Pria
1869378074,"KEMEJA TACTICAL W TAC - KEMEJA WTAC - LENGAN PENDEK - Putih, XXXL",17,5,109250,5,Kemeja Pria
1905731024,Manzone Kemeja Lengan Pendek RODRICK 6 - BEST BUY-BLACK,131,25,134900,5,Kemeja Pria
1715249301,MOC Kemeja Pria Lengan Pendek Slim Fit Crossby-Navy,91,76,94900,5,Kemeja Pria
8012536242,Aerostreet Kemeja Rayon Marva Hijau Army Hawai Polos Gelap QAAAA,331,53,84506,5,Kemeja Pria
8884512813,Kemeja Pendek Pria Tigris Arei Outdoorgear,11,0,329000,5,Kemeja Pria
12482306872,Giseu - Hibiki Zip Shirt,22,0,169000,5,Kemeja Pria
13149290043,Shirt Man Bowling Kemeja Cuban Hawai Kemeja Salur Stripe Pendek Pantai,244,54,55000,5,Kemeja Pria
5448670199,Simple Perfect Kemeja Pria Lengan Pendek Kerah Shanghai Solid White,123,64,129950,5,Kemeja Pria
1018707790,KEMEJA PUTIH POLOS FORMAL PRIA COWOK LAKI-LAKI COWO HEM LENGAN PANJANG,133,0,82345,5,Kemeja Pria
14245436416,Kemeja Polos Pria WOODCUTTER Basic Shortsleeve - Navy Blue Biru Pendek,23,29,156500,5,Kemeja Pria
14465340982,Peternation kemeja flanel wool basic panjang regular fit B1,57,0,205000,5,Kemeja Pria
1644490662,KEMEJA PRIA GREENFALO - KEMEJA LENGAN PANJANG PRIA WARNA UNGU / LILAC,203,0,87000,5,Kemeja Pria
14791240830,Heyplain Kemeja Oversized Linen Beigie - Bowling Oversized Linen Shirt,4,57,99000,5,Kemeja Pria
2869853811,Ancestor Kemeja Pria Kasual Motif Abstrak Lengan Pendek - Sandy,0,0,119000,0,Kemeja Pria
360701097,Alisan Kemeja Lengan Pendek Polos Slimfit Putih PLSSFSSPutih,394,14,210000,5,Kemeja Pria
2180603434,The Executive Pointed Pocket Long Sleeve Shirt 1-LSIBSC520O058 Maroon,100,36,179900,5,Kemeja Pria
11504556938,Joobsd Workshrit “Ambra” - Workshirt Zipper - Hitam - Unisex,24,0,129000,5,Kemeja Pria
10904233558,Baju Kemeja Pantai Hawai Pria Bali Shirt Rayon Printing Size Jumbo,169,56,59900,5,Kemeja Pria
15304027216,Kemeja Pria V-Neck Polos Lengan Panjang Marison / Atasan Kemeja Pria V-Neck Casual Lengan Panjang Korean Style,53,0,59999,5,Kemeja Pria
13189261521,Kemeja Polos Putih Kemeja Putih Kantoran Kemeja Pria ,0,0,85000,0,Kemeja Pria
12129561126,Platini Kemeja Motif Pria Lengan Pendek Katun Krem 73441,64,76,123000,5,Kemeja Pria
391458473,HEM KEMEJA IPMAN BAJU IMLEK PRIA LENGAN PANJANG WARNA PUTIH HITAM NAVY,157,79,57000,5,Kemeja Pria
13813865013,ICW Kemeja Pria Jumbo Polos Lengan Panjang 8XL LD148 150 Jumbo Premium,42,0,69900,5,Kemeja Pria
15244659197,HASIER Linen Oversized Long Sleeve Shirt,109,5,284050,5,Kemeja Pria
2524855824,FR James - Casual Surface Double Vest,188,0,192000,5,Kemeja Pria
7626661749,Kemeja Pria Lengan Panjang Flanel Cowok Korean Model Slimfit Kasual,79,0,85000,5,Kemeja Pria
8352209024,Aerostreet Kemeja Cotton Pendek Parker Beige Polos Cerah QBAAA,294,53,103306,5,Kemeja Pria
13859301042,Wear Kaza Indonesia - Shirt Blaz Stripe 'Ocean Green',4,5,158650,5,Kemeja Pria
8975348878,Noforty Kemeja Oversize Long Sleeve Ferde Black,49,50,170000,5,Kemeja Pria
8975348878,Noforty Kemeja Oversize Long Sleeve Ferde Black,49,50,170000,5,Kemeja Pria
9688173116,MOC Kemeja Lengan Pendek Pria FRAZIO - WHITE,2,69,86700,5,Kemeja Pria
7269377061,Kemeja Angsana seri Restrack High Performance Millitary Concept,51,0,250000,5,Kemeja Pria
15166183825,SANVANINA Sydney Stripes Oversized Longsleeve Shirt | Kemeja Garis Garis Pria Lengan Panjang |E-8603,11,61,128900,5,Kemeja Pria
15312544226,Kemeja Corduroy Pendek Oversize Jumbo  Casual  Kerah Diari,10,0,97300,5,Kemeja Pria
14354582064,Hakone Kemeja Boxy Fit Superfine Cotton In Black - Kemeja Boxy Premium Lengan Pendek Hitam - BYBLANK,7,21,159000,5,Kemeja Pria
11960327184,KEMEJA PRIA - RUSH GREEN POCKET CORDUROY SHIRT - KEMEJA LENGAN PENDEK,21,40,179400,5,Kemeja Pria
6738783339,Platini Kemeja Batik Pria Lengan Panjang Coklat 460549B,26,66,179000,5,Kemeja Pria
6492338588,Superego Flannel Green by Isser James FIS,18,42,349000,5,Kemeja Pria
11556206601,Kaza Indonesia - Longshirt Harvey Black,30,5,187150,5,Kemeja Pria
5476261635,Kemeja Pria Premium - ID1951999384,188,0,162500,5,Kemeja Pria
2653421253,kemeja baju pria cowok jumbo big size 4xl 5xl 6xl 7xl 8xl 9xl panjang,317,0,130000,5,Kemeja Pria
4300395045,kemeja pria lengan panjang slimfit polos warna navy,37,7,43245,5,Kemeja Pria
5516037247,MOC Kemeja Lengan Panjang Pria GLOXI - BROWN,11,68,129900,5,Kemeja Pria
14525666951,Livehaf - Oxford Long Shirt Midnight Blue,10,0,139900,5,Kemeja Pria
2962508904,kemeja motif pria,31,0,29000,5,Kemeja Pria
12730159891,Kemeja Kantor Pria Polos Model Fashion Lengan Panjang Formal Putih M,15,5,35625,5,Kemeja Pria
9268650953,KEMEJA PRINTING PRIA KEMEJA HAWAI PRIA KEMEJA VINTAGE KEMEJA MACHITAM,94,68,69000,5,Kemeja Pria
1220623915,kemeja pdi perjuangan lengan pendek resmi DPP PDIP,66,0,85000,5,Kemeja Pria
12612128418,Kemeja Lapangan PDL Antarestar Zeta Shirt Series Gunung Original,93,0,299000,5,Kemeja Pria
8637044539,Kemeja Pria Formal WD & Co. Slim Fit Black/Hitam Polos Lengan Panjang,30,62,129900,5,Kemeja Pria
12329723929,"KEMEJA PENDEK 3/4 ELBOW SLEEVE, STAND COLLAR SPLICED BUTTON. HQ",9,3,67415,5,Kemeja Pria
2188748600,Platini Kemeja Pria Lengan Panjang Basic Polinosic Navy 66104,180,68,159000,5,Kemeja Pria
13162320227,Troveast Kemeja Outdoor Work Shirt Lead Series Black,14,55,159000,5,Kemeja Pria
13593584482,Livehaf - Futon Long Shirt Beige,44,54,59900,5,Kemeja Pria
13264437490,M231 - Kemeja Jujutsu Kaisen Hidden Inventory Hijau 0496B,15,65,194000,5,Kemeja Pria
12068489823,Dzargo - Shanghai Kemeja Pria Lengan Panjang - Rayon,22,50,89000,5,Kemeja Pria
13027080063,Wildtime&Co - Longshirt Velvo White,4,5,205200,5,Kemeja Pria
1873686752,MOC Kemeja Pria Lengan Pendek Slim Fit Pochinski 2 Bestbuy-Blue,111,61,89900,5,Kemeja Pria
12255423661,Kemeja Pria Lengan Panjang Slimfit Kemeja Polos Pria ,331,0,115000,5,Kemeja Pria
1904309069,Kemeja Realtree Outdoor Pria Dewasa Tangn Pendek,236,0,80000,5,Kemeja Pria
11977727954,TENDENCIES Discovery Garage Work Shirt Dark Green,13,53,229000,5,Kemeja Pria
12782083793,"kemeja pria premium benang timbul,kemeja abu exclusive,kemeja pejabat",30,0,389000,5,Kemeja Pria
8409629727,`DUST - Kemeja Nadi Biru TENCEL™ Carbon Zero Comfease (DM. 1423),5,65,139000,5,Kemeja Pria
7214508977,Code Male - Giroud Jacket / Outer Shirt Twill Stretch Hitam,13,71,159900,5,Kemeja Pria
8005986753,Rown Division Short Shirts Kemeja Pendek Guille White,19,0,290000,5,Kemeja Pria
14289537885,Kemeja Pria Motif - JAPANESE VIEW,10,0,75000,5,Kemeja Pria
14159968912,Von Dutch Workshirt 1171 Black,4,20,607200,5,Kemeja Pria
11678607400,M231 Kemeja Pria Hawai Printing Hijau 3179B,13,70,119000,5,Kemeja Pria
10431147759,Kemeja Polos Jumbo Pria Lengan Panjang 2XL 3XL 4XL Hitam,123,0,59000,5,Kemeja Pria
9539780803,Kemeja Tactical W-Tac Panjang/Kemeja Lapangan/Kemeja Pria Panjang,141,0,115000,5,Kemeja Pria
1624334617,Kemeja Unisex Erigo Short Shirt Gribson Rayon Navy,3164,74,90000,5,Kemeja Pria
8860161841,Jobb Murshid Koko Pria Lengan Panjang Slim Fit Indigo Black,26,80,139800,5,Kemeja Pria
14670309406,baga Smart Shirt - Barreta,6,0,485000,5,Kemeja Pria
14297363459,Laskala Premium Batik Kalandra K12A626,10,5,470250,5,Kemeja Pria
7057245240,Simple Perfect Kemeja Pria Lengan Panjang Shanghai 7721 Black,24,65,139950,5,Kemeja Pria
15076069010,Kemeja Alisan Motiv Lengan Pendek Reguler,7,0,160000,5,Kemeja Pria
14156941796,Gemar Shirt Embroidery / Kemeja Bordir (pilih warna),43,12,175000,5,Kemeja Pria
10062578455,Rown Division Kemeja Panjang Helvetica Pink,7,0,320000,5,Kemeja Pria
12422556553,M231 Kemeja Pria Printing Hawaii Pendek 0227,37,72,119000,5,Kemeja Pria
12234013392,Wingman Denim | Sashiko Flannel Red,21,10,535500,5,Kemeja Pria
1664164772,KELVIN KEMEJA POLOS PRIA LENGAN PANJANG KEMEJA COWO FORMAL SLIM FIT,1469,79,57000,5,Kemeja Pria
1935225950,Kemeja Pria RR Putih Polos Dolby Regular Fit M to 5xl Big Size Panjang,69,0,180000,5,Kemeja Pria
14870133077,KEMEJA PANJANG QUICKDRY MOUNTAINGEER BADGE SERIES - KEMEJA LAPANGAN SAMAGAHA OUTDOOR,5,0,99000,5,Kemeja Pria
4631630923,Kemeja Pique Cottongo White,50,0,159000,5,Kemeja Pria
13773388013,Kemeja Lengan Pendek Pria Tactical Lapangan Hikemore Wild Terbaru,24,27,219000,5,Kemeja Pria
12729588235,Kremlin Shirt Kemeja Fullprint - Akai Kumo,252,40,149900,5,Kemeja Pria
7089484924,Simple Perfect Kemeja Pria Lengan Pendek Premium Basic 2233 Black,30,33,134500,5,Kemeja Pria
7888336618,Kemeja Pria Jumbo Lengan Panjang Polos Big Size XL XXL 3XL 4XL 5XL,63,0,59500,5,Kemeja Pria
14735040242,Wildtime&Co - Shirt Printed Flowave Series,2,5,190000,5,Kemeja Pria
6334621456,Wood Short Sleeve Oxford Shirt 2-SSXBSC521O028-LT.BLUE,64,25,299900,5,Kemeja Pria
11970811374,kemeja EIGER CLIFF CELEBES XTR ORIGINAL,9,0,199000,5,Kemeja Pria
13148270121,VISTULA - Kemeja Printing Pria Lengan Pendek - Leaves Pastel,32,0,175000,5,Kemeja Pria
7146250973,Kemeja Pria Polos Cotton Rayon - Sky Blue,55,0,115000,5,Kemeja Pria
6405971448,KEMEJA FLANEL PREMIUM BESTSELLER CATUR MERAH UNISEX,48,0,51713,5,Kemeja Pria
14615525477,Vobia Shirt - Kemeja Waffle Oversized,2,42,145000,5,Kemeja Pria
11143492980,Kemeja - Parisian Oxford Long Sleeve Shirt - Black,58,54,134585,5,Kemeja Pria
8382748226,Kemeja Pria LenganPpanjang Waffle Knit Aegyo Warna Putih,94,0,149000,5,Kemeja Pria
1646731766,Salice Paolo Kemeja Polos Pendek Reguler Fit Ukuran Jumbo XxxxL,153,0,125000,5,Kemeja Pria
12223759485,S4DD Kemeja Pria Oversize Salur Stripe shortsleeve Casual Kasual Basic,2,0,81000,5,Kemeja Pria
14791236253,Heyplain Kemeja Linen Lengan Panjang Hitam - Reguler Fit,2,64,109000,5,Kemeja Pria
12769496135,Ryusei Sht Isaka CMB White,14,0,170000,5,Kemeja Pria
12653286586,Kemeja Pendek Pria Cartenz Tactical Silencer New Colors,21,0,495000,5,Kemeja Pria
14011926103,Coop Design - Russell Kemeja Safari Pria,176,0,169900,5,Kemeja Pria
14365468850,ALISAN KEMEJA KANTOR FORMAL POLOS PRIA LENGAN PANJANG REGULER,1040,0,152900,5,Kemeja Pria
9116067452,KEMEJA TACTICAL LAPANGAN PDL M-TAC LENGAN PENDEK - BAJU BAHAN DRILL,436,0,90000,5,Kemeja Pria
7347657766,kemeja polos pria lengan panjang putih formal kasual slimfit m-xxxl,118,3,37345,5,Kemeja Pria
12076981252,Ben Sherman Gingham Button Down Shirt Original,12,0,575000,5,Kemeja Pria
881142923,Kemeja 100% Linen Pria Putih Panjang by REMEDY - Winter Linen Shirt,63,0,549000,5,Kemeja Pria
1857934778,XXXL XXL XL L Kemeja Polos Pria Panjang Slimfit / Baju Kerja / Hitam,810,0,35000,5,Kemeja Pria
7591753887,Paulmay Kemeja Lengan pendek Pria Reguler Fit Navy Shirt,27,0,199000,5,Kemeja Pria
9339593129,MOC Kemeja Lengan Pendek Pria BROKIO - BLUE,28,0,449900,5,Kemeja Pria
12919732676,M&S - Kemeja Pria - Linen Blend Shirt - Chambray,6,0,849900,5,Kemeja Pria
2034483197,INV CETAK SABLON KAOS SATUAN CUSTOM DTG + KAOS NSA SOFT BEBAS WARNA,152,0,132000,5,Kemeja Pria
3235747108,Kemeja PDL Outdoor Lapangan Lengan Panjang American Drill Hijau Army,401,0,115000,5,Kemeja Pria
2881030386,KEMEJA ONE PIECE LUFFY Dressrosa suit sunflower fullprint ALLSERIES,153,0,129900,5,Kemeja Pria
4784250023,CDL By Cardinal Kemeja Polos Tangan Panjang 1 (Hitam),16,0,449900,5,Kemeja Pria
1904559588,MOC Kemeja Pria Lengan Pendek MODERN FIT Sparo-Navy,21,70,97900,5,Kemeja Pria
12832225949,kemeja outdoor lapangan habit,35,0,57500,5,Kemeja Pria
661039015,Kemeja Pria Rita Ricci Putih Cerah Pilot Pendek Oxford Kantong Dua,689,0,162000,5,Kemeja Pria
12367343457,kemeja paspampres katun sretch sleting / kemeja lengan pendek  outdoor,47,0,162000,5,Kemeja Pria
8655456359,Kemeja Tenue de Attire - Officine Short Sleeve Shirt - Army Green,66,37,189584,5,Kemeja Pria
763878273,Carvil Kemeja Pria IGGY-01,57,65,122555,5,Kemeja Pria
2180603506,The Executive Pointed Pocket Shirt 1-LSIBSC520O058 Dark Forest,105,36,179900,5,Kemeja Pria
14214704366,Kemeja Lengan Pendek -  DON TOM II,38,14,98900,5,Kemeja Pria
11639954425,Alisan Kemeja Pria Jumbo Reguler Lengan Pendek Abu 6 Size 2XL - 4XL,173,0,166300,5,Kemeja Pria
2046747282,Kemeja Pria JB PSY Long Shirt Olive,769,42,191111,5,Kemeja Pria
6167338673,VANGUARD Tactical Shirt - Long Sleeve - Water Repellent,41,0,495000,5,Kemeja Pria
7750733131,Kemeja Putih Polos Premium Lengan Panjang Maldivees Series Beachwell,14,0,169900,5,Kemeja Pria
923535662,kEMEJA POLOS HEM LENGAN PANJANG KATUN PUTIH,35,0,65000,4,Kemeja Pria
7985676356,Jobb Rafayet Koko Pria Lengan Panjang Regular Fit Black,23,70,209700,5,Kemeja Pria
4355920413,kemeja alisan lengan pendek warna 14 - 16,665,0,143000,5,Kemeja Pria
8012638881,Aerostreet Kemeja Rayon Marva Krem Hawai Polos Cerah Pria Wanita QABAA,156,50,89900,5,Kemeja Pria
9727995864,Java Seven Baju Tactical Komando | Baju Komando Traga Fleece BSY,15,8,69000,5,Kemeja Pria
9102087698,Kemeja Print Telusur Kultur - Mesigit,72,65,175588,5,Kemeja Pria
6929177472,Redcliff Kemeja Pria Polos Panjang Tosca 6BK3474F 7A5,4,65,171080,5,Kemeja Pria
7179251708,Kemeja Overshirt Parabellum® Tiger Stripe Camo,22,0,750000,5,Kemeja Pria
14850093371,Arholma Studios - Oversized Shirt 'Valerion' Black,7,5,198930,5,Kemeja Pria
11956698064,NRDN Clothing Kemeja CORDUROY OVERSIZED SHIRT,2,0,260000,5,Kemeja Pria
15352677886,CUTOFF Saint Kemeja Open Collar Cuban Camp Bowling Shirt Oversized Rami,24,40,179000,5,Kemeja Pria
12123072910,Outskirts - Kemeja Polos Hitam Lengan Pendek I Kemeja Polos Pria,31,76,96900,5,Kemeja Pria
14442164904,Kemeja Flanel Lengan Panjang Kemeja Pria Flanel Unisex Casual,281,53,99000,5,Kemeja Pria
15499975899,Bahan Kain Corduroy import Kain Katun Corduroy 16 Wale,15,0,27900,5,Kemeja Pria
302932816,Kemeja Pria Alisan Putih Kantong Dua Pangkat Dinas Lengan Panjang,217,0,179000,5,Kemeja Pria
13797152376,RICARDO Kemeja Pria Motif Printing Daun Lengan Pendek Varian Warna 32416,8,71,154900,5,Kemeja Pria
13278739664,VISTULA - Kemeja Printing Pria Lengan Pendek - Floral Leaf Blue,35,0,165000,5,Kemeja Pria
13610786026,Uniqlo Hitam Kemeja Pendek Pria Polos Slimfit Kasual,63,0,120000,5,Kemeja Pria
12662194391,Kemeja Over Size Pria Kemeja Jumbo Pria Kemeja Lengan Panjang Pria,23,0,122300,5,Kemeja Pria
11789467629,Platini Kemeja Lengan Panjang Katun Salur 76442 Abu,21,67,169000,5,Kemeja Pria
13945573732,workshirt / kameja kerja carhartt navy,13,0,150000,5,Kemeja Pria
11044319421,MANZONE Kemeja Batik Lengan Panjang Pria BZB-BROTOKARNA 05,20,30,139900,5,Kemeja Pria
1044538698,Kemeja Pria Lengan Panjang Putih Kerah Shanghai Kancing1 Slimfit 3345,1391,0,95000,5,Kemeja Pria
9805566930,MOC Kemeja Lengan Pendek Pria BRENTWOOD 2-BLACK,16,39,169900,5,Kemeja Pria
12835192705,Kemeja Pria Erigo Koko Long Sleeve Basic Anam White,45,77,75000,5,Kemeja Pria
11425180489,Bowling Shirt Casual Kemeja Pendek Pria Santai Cuban Hawai,192,56,79000,5,Kemeja Pria
13836713222,Kemeja Pria Lengan Panjang Polos Big Size Besar Size Jumbo 2XL 3XL 4XL 5XL,30,40,109999,5,Kemeja Pria
725445203,MIX HEM MILLER KEMEJA PRIA LENGAN PANJANG KEMEJA COWO POLOS FORMAL,30,79,57000,4,Kemeja Pria
2107644931,Marks & Spencer - Kemeja Pria - White Slim Fit Easy Iron Shirt,21,11,444900,5,Kemeja Pria
12806249761,Ryusei Shirt Kurosaki CMB Grey,18,0,170000,5,Kemeja Pria
12811037371,Noir Sur Blanc Men Pointelle Shirt Mocha,2,0,490000,5,Kemeja Pria
6691096401,Kemeja tactical 511 lengan panjnag kemeja PDL Lapangan original,63,0,75000,5,Kemeja Pria
13989121295,"Mickout Casual Shirt ""Feathers"" Black",22,65,105000,5,Kemeja Pria
2163457933,KEMEJA PHILLIPWORKS LE MANS WORKSHIRT,6,0,499000,5,Kemeja Pria
12316122439,EIGER X-BATTLESEEKER 1.0 LS F1 SHIRT,58,20,367200,5,Kemeja Pria
11640090430,BROGUY kemeja pria lengan pendek formal basic Sage,17,58,79500,5,Kemeja Pria
15008212122,Levi's Men's Short-Sleeve Classic Standard Fit Shirt (86627-0229),6,0,549900,5,Kemeja Pria
11983195963,Kemeja Pria Big Size Ukuran Besar Jumbo XXL XXXL GDE WGB,158,0,119000,5,Kemeja Pria
2214114537,Kemeja Pertamina Putih Lengan Panjang Kemeja Alisan Terbaru,44,0,230000,5,Kemeja Pria
12628771644,Kalibre Kemeja Navy 980656,8,0,299000,5,Kemeja Pria
12329315299,Work Shirt Halfzip Oversize Fillingstreet - Veron Star,10,0,169999,5,Kemeja Pria
11439225937,Kemeja Pria Premium - Beach View Series,31,0,162500,5,Kemeja Pria
13971491946,POLICE Kemeja Basic Cotton Soft Regular Fit Pria Olive Tua,137,82,73000,5,Kemeja Pria
10498807552,Kemeja Pupuk Indonesia Seragam Pupuk Indonesia Navy Lengan Pendek Pria,5,0,130000,5,Kemeja Pria
10557922303,Russ Shirt Kemeja Flannel Tangan Panjang Yealls Yellow,8,0,350000,5,Kemeja Pria
14087728045,Broodis Kemeja Polos Hitam Kerah Shanghai SOFTEE/COLTEE Shanghai Black Lengan Panjang,76,67,99000,5,Kemeja Pria
13538581550,Kemeja polo basic casual pique big size jumbo oversize lengan pendek 3xl 4xl 5L PUTIH,7,3,96080,5,Kemeja Pria
14640290542,MSMO Men Margo / Kemeja Polos Pria / Kemeja Kantor / Kemeja Polos,12,61,149000,5,Kemeja Pria
1457869691,M231 Kemeja Pria Cotton Pique Pendek Warna Coklat 1793G,103,80,79800,5,Kemeja Pria
15237612063,ALISAN Pria Kemeja Polos Lengan Panjang - Slim Fit - Harga Grosir,10,5,87875,5,Kemeja Pria
13712165412,KEMEJA PRIA - STONE GLORIOUS FATE NAVY WORKSHIRT - KEMEJA LENGAN PENDEK,4,45,191950,5,Kemeja Pria
14998847127,Kemeja Alisan Merah Maroon Lengan Panjang Pria Slimfit Bahan Berkualitas Premium,9,10,83250,4,Kemeja Pria
12878247103,Seragam kerja putih/Kemeja kerja lengan panjang/Baju kemeja putih pria,13,0,119000,5,Kemeja Pria
11628469629,KEMEJA SATIN PRIA ukuran XS sampai JUMBO/ Kemeja Kondangan Pria,12,0,145000,5,Kemeja Pria
648367079,FortKlass JUAN Kemeja JUMBO Pria Lengan Pendek Kemeja Kasual Cowok,891,77,64000,5,Kemeja Pria
12293730576,Kemeja Putih Mahkamah agung Lengang Panjang,9,0,145000,5,Kemeja Pria
15655073403,Kemeja Alisan lengan pendek original reguler fit uk 16,374,4,182000,5,Kemeja Pria
10878678491,POSHBOY Lengan Pendek Kemeja Knit Pria Size S-XXL Berlin SZ-6E5,84,47,199900,5,Kemeja Pria
11059713245,KEMEJA POLOS PRIA LENGAN PANJANG HITAM SIZE M L XL XXL,223,0,65000,5,Kemeja Pria
11440176813,Moxie Vintage Corduroy Overshirt - Army green,3,36,191800,5,Kemeja Pria
15260956021,Semi Parka Kemeja Parka Pria Original Distro Bandung,140,6,169800,5,Kemeja Pria
13810676955,Biscia Overshirt Short Sleeve - SNDWR,84,0,230968,5,Kemeja Pria
12727848372,Kemeja Pria Lengan Panjang Kemeja Kerja Formal Prodigo Santolo HItam,8,60,99999,5,Kemeja Pria
10399350343,Simple Perfect Kemeja Pria Lengan Panjang Premium Polos 7714 Tosca,7,79,149950,5,Kemeja Pria
9753117048,Kemeja Haley Davidson - HDCI NEW PRODUK - BERKUALITAS NO 1,4,0,145000,4,Kemeja Pria
310806843,VM Kemeja JUMBO Tangan Pendek - Kemeja BIG Size 6XL,252,0,135000,5,Kemeja Pria
2650015169,Kemeja Pria Warna Putih Formal Polos Lengan Panjang Regular / Kemeja,57,0,66000,5,Kemeja Pria
11997324935,KEMEJA TACTICAL PANJANG WTAC,12,0,67000,5,Kemeja Pria
5323743991,KEMEJA COWOK LENGAN PENDEK LINEN PREMIUM - COCONUT LINEN SHIRT,21,0,389000,5,Kemeja Pria
14998430559,Kemeja POLO Polos Pria Premium Terbaru / Shirt Kasual Pria Kantor Lengan Panjang Bahan Katun,8,9,123305,5,Kemeja Pria
1891418751,Kemeja Panjang Cartenz Tactical Delta 01,30,0,395000,5,Kemeja Pria
