id,name,countReview,discountPercentage,price,rating,category
13104260532,RUDEBASIC - Summer Oversized Tee | HeavyWeight,16,10,179100,5,Kaos Pria
14798481074,Bundling TUPTIL - Nipple Cover Pria,55,12,115000,5,Kaos Pria
1827727553,Hammer Man Basic Tee Online Z1TO001-H1,683,53,89900,5,Kaos Pria
14638093778,Moutley Kaos Lengan Pendek Oversized RED M010824,8,50,119500,5,Kaos Pria
7806488850,"Voyager Outfitters T-Shirt - blink-182 ""I Miss You Lyric""",29,7,139500,5,Kaos Pria
2657697752,Merchcons Ultra Heavy 16s - Black,687,0,64100,5,Kaos Pria
7478217480,GT MAN SPORT SPDF-BLACK ROUND NECK QUICK DRY,393,47,61133,5,Kaos Pria
1211868365,Human Greatness Midweight T-shirt Black,913,30,105000,5,Kaos Pria
14620801215,Russ Poloshirt Rugby Tangan Pendek Gainner Broken White,44,60,139000,5,Kaos Pria
14542618979,Zalmore Men Vneck Top Premium Waffle,83,50,63500,5,Kaos Pria
10909073231,Von Dutch Tshirt 0851 Black,24,40,251400,5,Kaos Pria
14588650331,Ricky is Clown Black Mamba Snakeskin Embroidered Smiling Tee Black,3,0,850000,5,Kaos Pria
2037659254,Kaos Lengan Pendek warna Print DTG Custom / T-Shirt Cetak Sablon,875,0,70000,5,Kaos Pria
2083416589,Kaos Polos New States Apparel 7200 Premium Cotton T-shirt,7713,0,50000,5,Kaos Pria
14720200044,No Void Minds Litex Heavyweight Cotton TPF Oversized Core xT-Shirt | Charcoal,244,64,99900,5,Kaos Pria
14560001309,OCWA GAVIN OVERSIZED CROP MUSCLE TEE BLACK,7,0,249900,5,Kaos Pria
11692099625,KAOS POLOS PREMIUM COTTON COMBED 24S REGULER FIT T-SHIRT LENGAN PENDEK,4547,50,31000,5,Kaos Pria
11077274018,Celery Oversized Tee,69,10,179100,5,Kaos Pria
7849610644,HSCO Rugby Shirt Veld,66,32,149600,5,Kaos Pria
12661828264,TLM Merch - Persona 3 Reload (T-Shirt) I By The Lazy Monday,184,0,179000,5,Kaos Pria
963914832,KAOS GAME MOBILE LEGEND 1 SISI A,75,10,42300,5,Kaos Pria
14977371823,Deliwafa - Sobat Ngarit Nusantara | Long Sleeve | Atasan Lengan Panjang | Baju Pria Wanita,37,0,105000,5,Kaos Pria
8008006280,KAOS POLOS PRIA COTTON COMBED 30S REGULER FIT LENGAN PENDEK,97561,50,26000,5,Kaos Pria
12616905955,TRNOVR Kaos Reguler Fit | Rukawa Kaede | Rukawa 11,115,0,90000,5,Kaos Pria
15037202904,Kaos Pria Oversized / Oversized T-Shirt / Kaos Gym Fitness Gym / Kaos Olahraga Pria - Atalon Recovery Oversized T-Shirt,42,0,179000,5,Kaos Pria
14789191846,Moxie X Egmo Basic Boxy  T-shirt  - All Variant,32,77,44800,5,Kaos Pria
12979353054,Human Greatness Cross Stitch OS Green,129,52,145000,5,Kaos Pria
11108036110,Oversize Double Sleeve Tee Hood Spyt,108,30,175000,5,Kaos Pria
1410260481,Sipolos Kaos Oversize Pocket Lengan Pendek Cotton Combed 20S,414,52,95550,5,Kaos Pria
14083210035,HLPD WeirdWorld | Baju Kaos | T shirt | Boxy Tee - Basic Polos,170,65,69000,5,Kaos Pria
12692397992,RUDEBASIC - Lovers Oversized Tee | UNISEX,20,10,179100,5,Kaos Pria
14605219555,Vindes Store - Kaos - Bervakansi Divisi Liburan Black - SS,29,0,195000,5,Kaos Pria
14274104355,LSC Baju WONDR BY BNI unisex PREMIUM COTTON COMBAD 30s//LOCAL PRIDE,105,0,58000,5,Kaos Pria
12838700424,Cottonsupply Boxy Crop Tshirt Kaos Boxy Fit Cotton 24s,199,47,52900,5,Kaos Pria
11953297934,Coop Design - Hyunbin Kaos Polo Oversize Heavyweight Cotton 16S Unisex,440,3,77900,5,Kaos Pria
7121293851,Kaos Oversize Heavy Cotton 20s - Osaka Oversize Tshirt - ByBlank,400,0,99900,5,Kaos Pria
12419581203,Kaos Casual Patagon** premium,22,0,100000,5,Kaos Pria
12576642656,RUDEBASIC - Dark Ecstacy Oversized Tee | Heavy Weight,22,10,179100,5,Kaos Pria
12979363454,Human Greatness Cross Stitch OS Black,157,52,145000,5,Kaos Pria
14991975208,Von Dutch T-shirt 1147 BLack,12,30,293300,5,Kaos Pria
13077521396,Sipolos Heavy Weight T-Shirt Australian Cotton 16s,76,42,115750,5,Kaos Pria
1687825268,PROSHOP | DEWA 19 FORMAT MASA DEPAN | Kaos Pria Kaos distro | HITAM,1571,0,200000,5,Kaos Pria
15000050640,FNATIC ONIC Vencedor Away - Black,7,0,699000,5,Kaos Pria
6964599010,Fairgoods Kaos - Vacation Is Back - Putih,18,0,120000,5,Kaos Pria
11671186712,Kaos Polos Premium |Sinonims | Monochrome Basic T-shirt,807,19,81000,5,Kaos Pria
11794909032,RUDEBASIC - Carrot Oversized Tee | UNISEX,30,10,179100,5,Kaos Pria
14379652973,JAVAJONES Crop Boxy Tee Medvedev After Tennis Series,20,26,125060,5,Kaos Pria
15595010571,MATTHIEU MIGUEL - HIGH COLLAR OVERSIZED TEE - 220 GSM,16,50,99800,5,Kaos Pria
11217523832,Ader Error Foil Tape Logo,9,50,139500,5,Kaos Pria
14369206132,Cottonsupply Heavyweight Tshirt Kaos Boxy Crop Cotton 16s,150,54,69000,5,Kaos Pria
14697336787,[KAOS] Roman Reigns OTC T-Shirt - WWE,10,0,140000,5,Kaos Pria
14976866286,T-Shirt Bernadya Diego Black Tee Oversized,12,15,170000,5,Kaos Pria
13063285921,TENDENCIES Tshirt Oversized Social Colony White,96,60,99000,5,Kaos Pria
14639602830,MerchbySTRANGERS - UNKNOWN_1 BLACK T-SHIRT,146,0,245000,5,Kaos Pria
14708380378,Moxie X Egmo Basic T-shirt Oversize - All Variant,31,60,44800,5,Kaos Pria
1824109027,POT MEETS POP - LOGO SMOKE TEE BLACK,111,43,129000,5,Kaos Pria
11486437021,Otsky Kaos Polos Waffle 24s,81,74,71900,5,Kaos Pria
11798109217,Aerostreet Extra Soft T Shirt Reguler Polos Gelap Kaos T-Shirt KAAAA,2217,53,42206,5,Kaos Pria
2722788628,Insurgent Club - Tshirt Basic Oversize Birch,224,34,125000,5,Kaos Pria
5112595511,Otsky Kaos Polos Pocket Katun 24s Tshirt Vol 1,789,72,57900,5,Kaos Pria
4478579162,Human Greatness Kyoto Black,473,49,125000,5,Kaos Pria
1544472109,Duraking Kaos 100% Cotton SUPIMA Daily Wear Black,344,63,118000,5,Kaos Pria
12231868640,T-Shirt Oversize Grafis SSST Sentimental Tarot Heavyweight Hitam,45,20,191200,5,Kaos Pria
687693302,T-SHIRT KAOS POLOS LONGSLEEVE WHITE BASIC,166,0,77900,5,Kaos Pria
10660173239,Mnst T-shirt Oversize Pocket Basic,60,62,55000,5,Kaos Pria
2108163811,Turtle neck shirt kerah tinggi lengan pendek kaos polos houseofcuff,250,45,99000,5,Kaos Pria
12216697093,Frasser Promo Kaos Polos Unisex Soft Super PE Kaos Oblong Premium,472,80,15990,5,Kaos Pria
14678552288,Deliwafa - Sobat Ngarit | T-Shirt Regular | Kaos Lengan Pendek | Baju Pria Wanita,103,0,85000,5,Kaos Pria
8434883609,Carhartt Pocket Tee Loose Fit Black,22,0,649000,5,Kaos Pria
11307475791,Livehaf - Boxy Ease Tee Black,1448,0,109900,5,Kaos Pria
9600491091,UNKL347 Kaos Pria Lengan Pendek Warna Navy Motif NVNV,241,75,66000,5,Kaos Pria
14810022201,Vindes Store - Kaos - Vindes Death Star Neon Green - LS,5,0,255000,5,Kaos Pria
12299374891,"XXXL, XXXXL JUMBO SIZE TURTLE NECK / LEHER TINGGI LENGAN PANJANG",19,5,54150,5,Kaos Pria
14633996987,Livehaf - Staple Crop Tee Black,36,0,129900,5,Kaos Pria
2086198363,Kaos Polos New States Apparel 3600 Soft Tee T-shirt,4148,0,45000,5,Kaos Pria
14205077483,TSHIRT OVER DISTORTION - PENJELAJAH KOTA (FREE AWAY FLAG & STICKER PACK),12,0,215000,5,Kaos Pria
12907931500,No Void Minds AEZY TPF Oversized Core xT-Shirt | Steel,1662,64,99900,5,Kaos Pria
12393114016,Buffback Basic Kaos Polos Cotton Combed 30 S Steel Blue,80,62,36000,5,Kaos Pria
7060903008,Insurgent Club - Heavyweight Tshirt Kaos Polos Reguler Bordir White,433,34,125000,5,Kaos Pria
12033091081,Samwells Airflow Breezetech Oversize Tshirt,438,29,91590,5,Kaos Pria
13254923967,HLPD WeirdWorld | Baju Kaos | T shirt | Boxy Tee - Blink,29,55,89000,5,Kaos Pria
1544485639,Duraking Kaos 100% Cotton SUPIMA Daily Wear Navy,316,0,320000,5,Kaos Pria
13514124538,Tshirt Penora Black Thanksinsomnia,46,58,84000,5,Kaos Pria
5959463003,Infinide Kaos Polos Panjang 30S Cotton Combed 30s Premium,255,1,44550,5,Kaos Pria
13117529367,KAOS POLOS PRIA TSHIRT COTTON UNISEX OBLONG WARNA PUTIH WHITE P,531,0,16900,5,Kaos Pria
8596027926,Moxie Basic T-shirt Oversize 24s - All Variant,69,0,110000,5,Kaos Pria
6842946227,VIBES APPAREL | Noise | Kaos Oversize,57,56,79000,5,Kaos Pria
274452764,Kaos Polos KALOSTEE Premium Basic 28s 100% Cotton ( Putih / WHITE ),1827,0,47000,5,Kaos Pria
13415778844,Kaos Polos Pria Wanita Tapaxco T-Shirt Casual Local Catton Combed 30s,4758,74,28499,5,Kaos Pria
12704778896,KIZARU T-Shirt Music Series NEW JEANS,376,44,99900,5,Kaos Pria
2805684885,Human Greatness CoolTech T-shirt Black,2742,57,86000,5,Kaos Pria
15223254921,Human Greatness Otter OS T-Shirt Steel Blue HGBasic,40,59,130000,5,Kaos Pria
12963792894,Human Greatness Waffle Wimbledon Khaky Shirt,114,55,150000,5,Kaos Pria
15012823655,3Second x RRQ Kaos Pria Lengan Pendek Katun Aldous 460824,9,20,127200,5,Kaos Pria
14992729891,Reto x Danilla - Putri Seblay,18,0,250000,5,Kaos Pria
14999083263,AKANSATU - Everyday is Holiday T-Shirt,16,0,129000,5,Kaos Pria
13956731180,HLPD WeirdWorld | Baju Kaos | T shirt | Boxy Tee - Dance Star,36,55,89000,5,Kaos Pria
12979332967,Human Greatness Cross Stitch OS Beige,125,52,145000,5,Kaos Pria
11178458117,Kaos Stripe SINONIMS Premium Stripe T-shirt Putih,69,48,105000,5,Kaos Pria
1855736609,KAOS POLOS BIG SIZE UNISEX LENGAN PENDEK COMBED 30S UKURAN JUMBO BESAR,3779,50,37000,5,Kaos Pria
6982458528,Kaos Joger Spesial Putih Original Asli Bali,47,0,130000,5,Kaos Pria
14365967054,Aloomni T-shirt Terima Kasih Jokowi,11,0,149000,5,Kaos Pria
12885922371,Von Dutch Tshirt LT01 Brown,33,50,209500,5,Kaos Pria
14998009143,Sekut - Grindboys Sabotase,14,0,200000,5,Kaos Pria
8561485838,Insurgent Club - Heavyweight Tshirt Kaos Polos Boxy Fit Black,2080,37,119070,5,Kaos Pria
12907918999,No Void Minds AEZY TPF Oversized Core xT-Shirt | Charcoal,537,64,99900,5,Kaos Pria
652634731,Kaos Polos 16s Real Heavy Goods Black - Kaos Polos Hitam Katun,1767,0,120000,5,Kaos Pria
14426084255,T-Shirt Bernadya Sialnya Tracklist Black,165,0,210000,5,Kaos Pria
10994780242,Insurgent Club - Tshirt Kaos Small Logo Black,185,31,138000,5,Kaos Pria
14766383171,Kaos Polos Gildan - Softstyle 63000 Setara Cotton Combed 30's,295,0,45000,5,Kaos Pria
14868395512,The Guardian of Nusantara official T-shirt,135,0,186000,5,Kaos Pria
12488546350,POSHBOY Setelan Oblong Pria Celana Pendek Malone One Set,38,0,269900,5,Kaos Pria
3158287543,Sipolos Kaos Polos Earth Tone Lengan Pendek Cotton Basic White,346,48,77450,5,Kaos Pria
1399777113,Sipolos Kaos Polos Lengan Pendek Twotone Misty Cotton 30'S,4886,29,49900,5,Kaos Pria
12907925498,No Void Minds AEZY TPF Oversized Core xT-Shirt | Oatmeal,241,64,99900,5,Kaos Pria
14228535915,Kaos ADDS Sport Striped Graphic Tshirt New Original,98,31,239600,5,Kaos Pria
3161631416,Owners Long Sleeves - Star And Sunny,22,60,89000,5,Kaos Pria
8069522667,KAOS POLOS PANJANG PRIA COTTON COMBED 30S REGULER FIT,22007,50,33000,5,Kaos Pria
14424786143,Kaos Pria NIKE SPORTSWEAR SOLID EMBROIDERED BV0508010 ORIGINAL,2,33,249000,5,Kaos Pria
7291129137,Epidemic T-Shirt American Cotton 20s Armless,55,35,110500,5,Kaos Pria
810164829,HOOLIGANS - TERRAIN - BLACK,234,49,94000,5,Kaos Pria
14605146888,Vindes Store - Kaos - Bervakansi Divisi Liburan Olive - LS,17,0,249000,5,Kaos Pria
15222657555,Human Greatness Otter OS T-Shirt Black HGBasic,94,59,130000,5,Kaos Pria
8924901858,Straight Vision - Beudied Longsleeve T-Shirt,34,42,115000,5,Kaos Pria
12261958756,Mnst Crop Boxy Oversize Tshirt | Kaos Polos Boxy Fit,34,54,69000,5,Kaos Pria
1790604852,Sablon Custom Satuan Bebas Desain Kaos KPM Apparel Classic Premium,453,0,57000,5,Kaos Pria
14459948702,Proshop | Cukup Siti Nurbaya  Dewa 19 Tshirt | Kaos Pria Kaos Distro | Hitam,151,0,200000,5,Kaos Pria
3579236615,Kaos Polos Oblong Pendek Soft Combed 30s,13140,0,25000,5,Kaos Pria
11664313915,BILLIONAIRES PROJECT BASIC - T-SHIRT SUNDAYS COFFEE CLUB BLACK,59,0,179000,5,Kaos Pria
14834097726,PERSIB X KOIL HANYA UNTUK MENANG T-SHIRT,13,0,239000,5,Kaos Pria
13881332749,Kaos DUA LIPA Oversize Black Combed 24s / Tshirt Music DUALIPA Merch Radical Optimism VINTAGE 90an,2,18,118900,5,Kaos Pria
1710398411,Life Behind Bars - LBB x LBB - Fork Skewer Long Sleeve Tee,21,0,294000,5,Kaos Pria
2643666974,Bloods Tshirt Tribe Navy,166,50,72500,5,Kaos Pria
12532888872,Wellborn Crash Oversized Black T-shirt,50,37,120000,5,Kaos Pria
10909186926,Von Dutch Tshirt 0854 Navy Blue,13,40,251400,5,Kaos Pria
14256215567,Kaos Wondr BNI Kaos Official Seragam Jumat Bank BNI,150,0,63000,5,Kaos Pria
6775893283,Baju Barong Size Jumbo,254,0,22900,5,Kaos Pria
10987493344,Von Dutch Tshirt 0861 Navy Blue,25,40,251400,5,Kaos Pria
13650416386,Tshirt Estrine Black Thanksinsomnia,20,53,94000,5,Kaos Pria
14133460631,PAKET 3 PCS KAOS POLOS COTTON COMBED 30S PREMIUM BAJU POLOS PRIA,146,0,129000,5,Kaos Pria
14964891123,Deliwafa - Sobat Ngarit Nusantara | T-Shirt Regular | Baju Pria Wanita | Kaos Iyun,31,0,85000,5,Kaos Pria
12638872404,Kaos Oversize Polos Cotton Combed 24s | Unisex,665,0,50900,5,Kaos Pria
11687576380,VANS AP NASCENT SS TEE VN0A5F28BLK,3,61,301896,4,Kaos Pria
14787533185,EMCN Oversized Tee Drake Certified Lover Boy CLB,57,0,164000,5,Kaos Pria
3446627236,Kaos Tactical BDU Dark Black,23,0,100000,5,Kaos Pria
6867706698,Fairgoods Kaos - Love Summer - Putih,54,43,69000,5,Kaos Pria
3191725504,Buffback Kaos Polos Cotton Combed 30 S Cream h56163,53,61,37000,5,Kaos Pria
11307563085,Livehaf - Boxy Ease Tee Denim,613,0,109900,5,Kaos Pria
2137167173,Kaos Outdoor Pendaki Gunung TNF4,46,0,65000,5,Kaos Pria
11312085363,Livehaf - Boxy Ease Tee Olive,239,0,109900,5,Kaos Pria
2805816606,Human Greatness CoolTech T-shirt White,1662,57,86000,5,Kaos Pria
9155081248,AGLXY x Salad Stop! - White,44,0,300000,5,Kaos Pria
13081000180,Vibin tshirt,23,0,175000,5,Kaos Pria
14588682527,Ricky is Clown Black Mamba Snakeskin Embroidered Smiling Tee White,2,0,850000,5,Kaos Pria
10533368229,Kaos Polos BAMBOO COOLSOFT COTTON 100% Ringspun Katun Bambu Reaktif 30,5109,0,37900,5,Kaos Pria
11958411769,DUA LIPA - SELF TITLED TSHIRT BLACK,16,10,270000,5,Kaos Pria
11721938803,KIZARU Kaos Anime One Piece SHP CREW,846,50,89900,5,Kaos Pria
6686815230,Tshirt Dia Lupa | Baju Parodi Dua Lipa - Dia Lupa | Pleasure World,93,0,89900,5,Kaos Pria
13100741503,TENDENCIES Tshirt LS Oversized Double Layer Olive,23,56,99000,5,Kaos Pria
1953851854,Infinide T-Shirt Kaos Polos BIG OVERSIZE HITAM Cotton Combed 24s,1495,1,49500,5,Kaos Pria
12343902543,"Melo Oversized Tee ""Kern"" Black Washing",33,68,111000,5,Kaos Pria
13626394176,Dobujack Tshirt Sketface Black Longsleeve,14,62,95000,5,Kaos Pria
15011265114,Tshirt Avenia Dark Grey Thanksinsomnia,19,54,92000,5,Kaos Pria
14013065351,SSST Boxy Tanktop Heavyweight Black,14,0,239000,5,Kaos Pria
4264729426,KAOS POLOS OVERSIZE COTTON COMBED 24S OVERSIZED TSHIRT BIG SIZE UNISEX,3069,50,47000,5,Kaos Pria
12287773646,Tshirt Izaina Black Thanksinsomnia,96,53,94000,5,Kaos Pria
6897822001,Kaos Polos Premium KALOSTEE Oversized 24s 100% Cotton - DUSTY PINK,147,0,59000,5,Kaos Pria
8059169270,JERSEY TEAM LIQUID LVTHN 2023 DOTA TERBARU,30,0,90000,5,Kaos Pria
12960605936,Vindes Store - Kaos - T-Shirt VDS S4 Black - LS,33,0,220000,5,Kaos Pria
1135042837,Human Greatness Heavy Cotton T-shirt Black,1159,33,130000,5,Kaos Pria
12616891461,TRNOVR Kaos Reguler Fit | Gojo Satoru | Gojo Sensei,38,0,90000,5,Kaos Pria
12963801295,Human Greatness Waffle Wimbledon Black Shirt,176,55,150000,5,Kaos Pria
5322654345,SABLON CUTTING POLYFLEX SATUAN - METERAN,180,0,1000,5,Kaos Pria
12979321908,Human Greatness Cross Stitch OS Khaki,77,52,145000,5,Kaos Pria
12754429325,Kaos Tanktop Hitam Oversized - Cotton Combed 24s,18,42,75000,5,Kaos Pria
6867300667,Aerostreet T Shirt Long Sleeve Polos Gelap Kaos Longsleeve OAAAA,605,50,79900,5,Kaos Pria
14541760046,Heyplain T-Shirt Washed Oversized - 001,21,50,99000,5,Kaos Pria
13161670452,[BOXY 16S] Oversize Heavy Cotton 16s From Zelus Apparel Bahan TEBAL,35,43,113000,5,Kaos Pria
14030830109,Otsky Kaos Pria Ft Lakers Black X GM004 Cotton 24s,38,62,86900,5,Kaos Pria
10307858363,GOOD BYE EX - Tshirt Washed Justice,45,62,89900,5,Kaos Pria
14130787732,"Kaos Oversize Gym Scuba Tebal ""12 reps cardio"" putih Khaki Hitam MTS37 MTS38 MTS39",10,50,143000,5,Kaos Pria
3661223886,POISON FOREVER IM WAITING TEES BLACK,15,8,165000,5,Kaos Pria
6039798142,Merchcons Ultra Heavy 16s tshirt - white,262,0,64100,5,Kaos Pria
5021287859,Bloods Tshirt Consader 01 Black,125,50,75000,5,Kaos Pria
12948672345,Kaos Duha Muslimwear - Rahab T-shirt - Light Khaki,22,4,199583,5,Kaos Pria
6824347412,Kaos polos cotton combad 24s tanpa jahitan samping merk merchons,570,0,48500,5,Kaos Pria
14415397805,kaos underrated people / kecanduan kekuasaan,17,0,160000,5,Kaos Pria
7151993593,LIVEHAF - Cool Enzyme Tee White,678,0,89900,5,Kaos Pria
13042539488,TENDENCIES Tshirt Oversized Good Morning Elmo White,61,59,103000,5,Kaos Pria
12079746072,Kaos Oversize Graphic Teddy Bear 3D Waistbag Pocket Tshirt Unisex ,31,0,99400,5,Kaos Pria
13385764768,Black ID - T shirt Pria Lengan Pendek Hitam | Ts Aclaim,10,22,105000,5,Kaos Pria
12865573739,Commongoods Sleeveless T-Shirts Series,110,26,66000,5,Kaos Pria
2588823732,Kaos Polos - Anti Bacterial & Anti Odor,319,0,53000,5,Kaos Pria
14840054942,Kaos Pria UNDER ARMOUR TIGER TECH 2.0 SS 1377843001 ORIGINAL,5,48,209000,5,Kaos Pria
11433016809,"Mickout Oversized Tee ""Ficka"" Black",83,74,87400,5,Kaos Pria
13932071579,Cosmic T-Shirt Kaos Pria MODEL KIT LS Lengan Panjang,15,48,120000,5,Kaos Pria
6951956209,Infinide T-Shirt Kaos Polos SAKU HITAM Coton Combed 24s Premium,71,1,49500,5,Kaos Pria
14979237913,TENDENCIES Tshirt Oversized White Social Ten,11,62,95000,5,Kaos Pria
14782042562,Kaos Sekolah Pendaki Gunung Wanadri SPG MUSTARD-NAVDAR,4,0,155000,5,Kaos Pria
12085554845,BROGUY Kaos Polos Waffle Lengan Pendek Chestnut,81,45,59500,5,Kaos Pria
5142735550,Otsky Kaos Polos Lengan Pendek Tshirt Cotton Combed 24s Vol 1,285,74,57900,5,Kaos Pria
12111722167,kaos custom satuan baham combed 24 s,149,0,60000,5,Kaos Pria
12860601689,Commongoods Heavy Weight Oversize Pocket T-Shirts Series,180,25,104000,5,Kaos Pria
12685841153,Tetestuang Kaos Gus Dur Hati Bersinar |Kaos Gus Dur Naik Vespa| PLU 19,11,0,150000,5,Kaos Pria
14788781774,Oversize Tee Frank Ocean Big Print,27,0,164000,5,Kaos Pria
2086493749,Part 2 - Kaos Polos New States Apparel 7250 Premium Cotton Ringer,352,0,53000,5,Kaos Pria
12886046570,Von Dutch Tshirt LT04 Bottle Green,23,50,209500,5,Kaos Pria
2067937545,Henley Hoodie Aadeem / Kaos Hoodie Katun Bambu / Kaos Kupluk Pria,183,0,85000,5,Kaos Pria
15145164053,"Kaos Polos Katun Bambu 24s, Cotton Bamboo, Original Bergaransi",572,0,69000,5,Kaos Pria
15224561308,Kaos Coolsoft Katun Bambu Tebal 24S / Cotton Bamboo Kaos Polos Pendek,429,0,41500,5,Kaos Pria
4954089021,Muji Basic T-Shirt Heather Grey,88,60,51600,5,Kaos Pria
1705590942,Kaos Polos Cotton Bamboo 24s Anti Bakteri Katun Bambu Premium 24S,329,0,58000,5,Kaos Pria
15087815527,Kaos Dewa 19 tapi bayinya dah gede,2,0,135000,5,Kaos Pria
1276802333,Kaos Polos Cotton Combed 24s Lengan Pendek Premium,2516,5,35815,5,Kaos Pria
12392530107,Dippolar Love The Eartj,50,0,85000,5,Kaos Pria
2272356679,Custom Your Tshirt Design,147,0,159000,5,Kaos Pria
14328696331,Kaos Polos Pria Tapaxco Pocket White T-Shirt Local Cotton Combed 30s,58,69,40000,5,Kaos Pria
2382864348,PROSHOP | DEWA 19 LASKAR CINTA TSHIRT | Kaos Pria Kaos distro | HITAM,2180,0,200000,5,Kaos Pria
14334717780,MLB NY Yankees Classic Monogram Big Lux Overfit Tee Black,4,0,1399000,5,Kaos Pria
5235639507,Shining Bright REJECTED RANDOM TSHIRT SALE,143,15,49900,5,Kaos Pria
7385616485,Kaos Polos ULTIFRESH - 100% Polyester - Anti Bacterial dan Anti Odor,136,0,53000,5,Kaos Pria
4468037148,Rown Division Kaos Lengan Panjang Modensty Black,131,56,88000,5,Kaos Pria
1508172755,HOONEYBEE - KAOS OVERSIZED TSHIRT OVERSIZE TEE NY NEW YORK,592,0,95000,5,Kaos Pria
804148487,Insurgent Club - Heavyweight Tshirt Kaos Polos Boxy Fit White,783,34,125000,5,Kaos Pria
640108919,Kaos Polos Big Size 2XL - 5XL Cotton Combed 24s Lengan Pendek,2190,5,55711,5,Kaos Pria
13173108906,T-SHIRT | BOXY | POLOS | BLACK | AFTERSUNDAYS,8,0,180000,5,Kaos Pria
2767268490,Kaos NSA (New States Apparel) 7200 Premium Cotton - S M L XL XXL XXXL,3214,0,52000,5,Kaos Pria
12653656652,Kaos Polos Cotton Combed Lengan Pendek Unisex fit 1 - Fatto A Mano,30,35,46800,5,Kaos Pria
13955700989,Ryusei Kaos Pria Kamazaki Button White,19,39,89000,5,Kaos Pria
2086880449,Kaos Polos New States Apparel 7280 Premium Cotton Lengan Panjang,2653,0,69000,5,Kaos Pria
14782031166,Kaos Sekolah Pendaki Gunung Wanadri SPG BLACK-NAVDAR,16,0,150000,5,Kaos Pria
10444016719,RHID - T-shirt Basic RBG black limited edition -unisex,28,8,55000,5,Kaos Pria
13604447434,Tshirt Typo Merlin Black Thanksinsomnia,34,67,99000,5,Kaos Pria
2285353087,Kaos Gildan Softstyle 63000 Original ( S M L XL ),2567,0,41500,5,Kaos Pria
13797110544,Belkote X Muklay - T-shirt,2,0,210000,5,Kaos Pria
11950728780,RAGE AGAINTS THE MACHINE - BURNING MONK TEE (BLACK),51,10,225000,5,Kaos Pria
4682703616,Kaos Polos REAL COTTON COMBED 20S Premium,101,0,39500,5,Kaos Pria
647212717,Kaos Polos 16s Real Heavy Goods White - Kaos Polos Putih Katun,1231,0,120000,5,Kaos Pria
2037661362,Kaos Lengan Pendek putih Print Custom / T-Shirt white Cetak Sablon DTG,423,0,62000,5,Kaos Pria
14419901127,AKANSATU - Game Changer T-Shirt,47,0,129000,5,Kaos Pria
2323118508,Kaos Polos KPM Apparel Classic Premium Size Dewasa Part 1,4852,56,52283,5,Kaos Pria
1815676776,KAOS POLOS OVERSIZE BASIC COTTON COMBED 24s BIGSIZE TSHIRT OVERSIZED,3886,37,61900,5,Kaos Pria
9451093578,Predecessors taf t-Shirt teetimetochill black disto,33,54,86000,5,Kaos Pria
10581000841,Giordano Plain Crew Neck T-Shirt B,29,20,79200,5,Kaos Pria
11874614692,Tetestuang Kaos Dakwah Wala Taiasuu | Kaos Kata-Kata Islami - QTS 6,25,0,150000,5,Kaos Pria
1135061866,Human Greatness Heavy Cotton T-shirt White,521,33,130000,5,Kaos Pria
11792123990,MORWICK - Kaos Long Sleeve Lengan Panjang Pria - Epitome - Hitam,25,52,91000,5,Kaos Pria
12404080841,TRNOVR Kaos Oversize HEAVYWEIGHT Cotton UNISEX,149,0,90000,5,Kaos Pria
12468064325,Kaos Jumbo Pria Big Size 2XL 3XL 4XL Lengan Pendek,86,3,72750,5,Kaos Pria
2993796050,Kaos Pria Lengan Panjang Luthien Arei Outdoorgear,102,0,129000,5,Kaos Pria
2984688686,Kaos Lengan Pendek Pria Arei Origin Hijau Army Arei Outdoorgear,61,10,107100,5,Kaos Pria
5628581524,BAJU KAOS SUPERMAN . BAJU KAOS MURAH . SUPERMAN,53,0,50000,5,Kaos Pria
11808603688,POT MEETS POP - PMP UNIVERSITY TEE GREEN,12,0,250000,5,Kaos Pria
11307610052,Livehaf - Boxy Ease Tee Gray,581,0,109900,5,Kaos Pria
1141718409,Human Greatness T-shirt Long Sleeve Black,505,43,83000,5,Kaos Pria
13698923458,Kaos Polos Gildan - Premium 76000 Lengan Pendek Tanpa Jahitan Samping,277,0,63000,5,Kaos Pria
13080071955,KIZARU Kaos Band MY CHEMICAL ROMANCE ONE PIECE BROOK,300,50,89900,5,Kaos Pria
4320258145,Shining Bright Bart Tshirt - Black,57,0,200000,5,Kaos Pria
8426078849,Kaos Polos Lengan Panjang Combed 30s,2370,0,30000,5,Kaos Pria
13102942966,Kamengski - Stusi Black Long Sleeve Tee,23,0,220000,5,Kaos Pria
3224283284,HOOLIGANS T-Shirt LS Linea 22.1 Black,191,48,98800,5,Kaos Pria
4427772547,Kale Kaos Polos Cotton Combed 30S - Tshirt Arion Variasi Green,1423,39,83000,5,Kaos Pria
14387874979,Zetsu Project Tshirt Anime Demon Slayer Zenitsu,47,12,87736,5,Kaos Pria
12554884067,Human Greatness Minks OS T-Shirt Navy HGBasic,291,57,130000,5,Kaos Pria
9543372515,Colourspace Longsleeve Dark Wraith LS 003 Black,51,49,102000,5,Kaos Pria
12616869385,TRNOVR Kaos Reguler Fit | Megumi Fushiguro | Jujutsu Kaisen,77,0,135000,5,Kaos Pria
10602178808,CLOWOR Son Goku Strongest Forms Dragon Ball Anime Kaos T-shirt,171,35,130000,5,Kaos Pria
5826075723,"Kaos Lengan Panjang ""Elders Company - West Chopper"" Black",30,0,295000,5,Kaos Pria
15145493211,Kaos baju toyota landcruiser VX80 Turbo Modified Autowear,28,0,139000,5,Kaos Pria
12403508140,Larusso | Attack on Titan T Shirt Beast Titan Short Sleeve Graphic Tee,15,0,249900,5,Kaos Pria
13145353966,Tshirt MATA PISAU x JENNY Who The F**k,21,0,208390,5,Kaos Pria
7478382702,GT MAN SPORT SPDF-WHITE ROUND NECK QUICK DRY,264,47,61133,5,Kaos Pria
14756756986,CLOWOR Omegamon Merciful Mode Evolution WarGreymon MetalGarurumon Omnimon Digimon Anime Kaos T-Shirt,7,35,130000,5,Kaos Pria
8770942278,Morfem - Little Rascal II Hitam,64,0,205000,5,Kaos Pria
13752416476,T-SHIRT PSIM ISTIMEWA 2023,8,30,83300,5,Kaos Pria
2349132565,KAOS JUMBO PRIA POLOS 30S BIGSIZE 2XL 3XL 4XL 5XL 6XL 7XL,2129,0,58050,5,Kaos Pria
4025098826,kaos ultras garuda indonesia depan belakang,26,0,110000,5,Kaos Pria
13738239873,Kaos ProRock Engineering X Making Cars Museum - Jersey Black Red,12,0,190000,5,Kaos Pria
11915863798,Ludenssect - H.W.S SS Black T-Shirt ,26,33,110000,5,Kaos Pria
7715337670,New Kaos / Jersey Yonex Player Indo Master SUV Tru Air 2463 Denim Navy,242,26,185000,5,Kaos Pria
11254926255,Pine Beige T-Shirt - Club of Five,44,0,299000,5,Kaos Pria
12688736974,POSHBOY Setelan Oblong Pria Celana Pendek Shaq One Set,36,80,53980,5,Kaos Pria
14720205572,No Void Minds Litex Heavyweight Cotton TPF Oversized Core xT-Shirt | Steel,100,64,99900,5,Kaos Pria
12979342716,Human Greatness Cross Stitch OS Blue,109,52,145000,5,Kaos Pria
14893592475,HTTP Jersey Oversize Navy Jordan Kaos Jersei Casual Pria Wanita Lengan Pendek Unisex,3,46,135000,5,Kaos Pria
11255049539,Pine Navy T-Shirt - Club of Five,47,0,299000,5,Kaos Pria
11841857550,Von Dutch &  Kustomfest Edition KF01 Yellow,11,0,300000,5,Kaos Pria
12143738606,Kaos Polos COTTON COMBED 20s Lengan Pendek UNISEX SIZE XS-XXL,2336,0,28999,5,Kaos Pria
12569240843,KKONTENER FRANK OCEAN RELAXED FIT TSHIRT WHITE,14,34,99000,5,Kaos Pria
14553552694,2 TIMES TOO Boxy Daily Tee (Tshirt)  / SS24,3,0,249000,5,Kaos Pria
10856880124,Livescoot Tshirt Short Sleeve - Chung White,30,6,145000,5,Kaos Pria
12106116751,Stussy Basic Black Tee (100% Authentic),26,0,649000,5,Kaos Pria
1668642945,Kaos Polos Soft Premium PE / Polyester Netral,1498,0,20000,5,Kaos Pria
14516931694,KAOS POLOS MURAH PRIA DAN WANITA / KAOS OBLONG MURAH / COD,4757,0,19000,5,Kaos Pria
13167764878,Kaos polos merchons 24s,59,0,48000,5,Kaos Pria
11307739806,Livehaf - Boxy Ease Tee Plum,324,0,109900,5,Kaos Pria
